in/out/ambiguous,start_human,start_llm,end_human,end_llm,Transcript,story_seg_human,story_seg_llm,intersection,union
in,TRUE,TRUE,FALSE,FALSE,CHI: they came home from school .,TRUE,TRUE,TRUE,TRUE
out,FALSE,FALSE,FALSE,FALSE,INV: <mhm> [>] .,TRUE,TRUE,TRUE,TRUE
in,FALSE,FALSE,FALSE,FALSE,CHI: <and> [<] their mom said that they were gonna go out to eat .,TRUE,TRUE,TRUE,TRUE
out,FALSE,FALSE,FALSE,FALSE,CHI: mhm .,TRUE,TRUE,TRUE,TRUE
out,FALSE,FALSE,FALSE,FALSE,CHI: and she said where do you wanna go ?,TRUE,TRUE,TRUE,TRUE
in,FALSE,FALSE,FALSE,TRUE,CHI: and <they> [/?] Lisa and Raymond shouted out Mcdonalds .,TRUE,TRUE,TRUE,TRUE
out,FALSE,FALSE,FALSE,FALSE,INV: uhhuh .,TRUE,FALSE,FALSE,TRUE
in,FALSE,TRUE,FALSE,FALSE,CHI: and then their mom <drove to Mcdonalds and> [/?] drove to Mcdonalds .,TRUE,TRUE,TRUE,TRUE
in,FALSE,FALSE,FALSE,FALSE,CHI: and then they got inside .,TRUE,TRUE,TRUE,TRUE
out,FALSE,FALSE,FALSE,FALSE,INV: <mhm> [>] .,TRUE,TRUE,TRUE,TRUE
in,FALSE,FALSE,FALSE,FALSE,CHI: <and> [<] they were walking inside .,TRUE,TRUE,TRUE,TRUE
in,FALSE,FALSE,FALSE,FALSE,CHI: and then they got inside .,TRUE,TRUE,TRUE,TRUE
in,FALSE,FALSE,FALSE,TRUE,CHI: Raymond knew what he wanted to eat .,TRUE,TRUE,TRUE,TRUE
in,FALSE,TRUE,FALSE,FALSE,CHI: and his mom <know what he wanted> [/?] knew what she wanted to eat .,TRUE,TRUE,TRUE,TRUE
out,FALSE,FALSE,FALSE,FALSE,INV: mhm .,TRUE,TRUE,TRUE,TRUE
in,FALSE,FALSE,FALSE,FALSE,CHI: and then +...,TRUE,TRUE,TRUE,TRUE
in,FALSE,FALSE,FALSE,TRUE,CHI: <and> [/?] but Lisa didn't know what to order .,TRUE,TRUE,TRUE,TRUE
out,FALSE,FALSE,FALSE,FALSE,INV: okay [>] .,TRUE,FALSE,FALSE,TRUE
in,FALSE,TRUE,FALSE,FALSE,CHI: <she> [<] thought and thought about it .,TRUE,TRUE,TRUE,TRUE
in,FALSE,FALSE,FALSE,TRUE,CHI: and then she ordered <a happy meal> [/?] &*INV:mhm a happy meal <a chocolate cone> [/?] a chocolate icecream &*INV:mhm and a chocolate milkshake <um &~th> [/?] and a happy meal .,TRUE,TRUE,TRUE,TRUE
out,FALSE,FALSE,FALSE,FALSE,INV: okay .,TRUE,FALSE,FALSE,TRUE
in,FALSE,TRUE,FALSE,FALSE,CHI: and the clerk said it would be twelve fifty .,TRUE,TRUE,TRUE,TRUE
out,FALSE,FALSE,FALSE,FALSE,INV: mhm .,TRUE,TRUE,TRUE,TRUE
in,FALSE,FALSE,FALSE,FALSE,CHI: and &-um (7.) +...,TRUE,TRUE,TRUE,TRUE
out,FALSE,FALSE,FALSE,FALSE,INV: do you remember anything else ?,TRUE,TRUE,TRUE,TRUE
in,FALSE,FALSE,FALSE,TRUE,CHI: and then she reached down to her purse .,TRUE,TRUE,TRUE,TRUE
out,FALSE,FALSE,FALSE,FALSE,INV: mhm .,TRUE,FALSE,FALSE,TRUE
in,FALSE,TRUE,FALSE,FALSE,CHI: and she couldn't find it .,TRUE,TRUE,TRUE,TRUE
in,FALSE,FALSE,TRUE,FALSE,CHI: and then she realized she left it at home on the counter .,TRUE,TRUE,TRUE,TRUE
out,FALSE,FALSE,FALSE,FALSE,INV: okay .,FALSE,TRUE,FALSE,TRUE
in,TRUE,FALSE,FALSE,TRUE,CHI: this guy's name is gonna be Ron .,TRUE,TRUE,TRUE,TRUE
out,FALSE,FALSE,FALSE,FALSE,INV: okay [>] .,TRUE,FALSE,FALSE,TRUE
out,FALSE,FALSE,FALSE,FALSE,CHI: <sorry> [<] .,TRUE,FALSE,FALSE,TRUE
out,FALSE,FALSE,FALSE,FALSE,INV: okay .,TRUE,FALSE,FALSE,TRUE
in,FALSE,TRUE,FALSE,FALSE,CHI: Ron &*INV:mhm woke up one morning .,TRUE,TRUE,TRUE,TRUE
out,FALSE,FALSE,FALSE,FALSE,INV: mhm .,TRUE,TRUE,TRUE,TRUE
out,FALSE,FALSE,FALSE,FALSE,CHI: at +...,TRUE,TRUE,TRUE,TRUE
in,FALSE,FALSE,FALSE,FALSE,CHI: Ron was asleep um xxx xxx .,TRUE,TRUE,TRUE,TRUE
out,FALSE,FALSE,FALSE,FALSE,INV: no that's okay .,TRUE,TRUE,TRUE,TRUE
out,FALSE,FALSE,FALSE,FALSE,INV: look at the pictures and see what he's doing .,TRUE,TRUE,TRUE,TRUE
in,FALSE,FALSE,FALSE,FALSE,CHI: Ron woke up .,TRUE,TRUE,TRUE,TRUE
in,FALSE,FALSE,FALSE,FALSE,CHI: and he figured out that he overslept when his alarm went .,TRUE,TRUE,TRUE,TRUE
out,FALSE,FALSE,FALSE,FALSE,INV: mhm .,TRUE,TRUE,TRUE,TRUE
in,FALSE,FALSE,FALSE,TRUE,CHI: next he went downstairs and poured his cereal .,TRUE,TRUE,TRUE,TRUE
in,FALSE,TRUE,FALSE,FALSE,CHI: but he wasn't looking at his thing when he was doing the cereal .,TRUE,TRUE,TRUE,TRUE
in,FALSE,FALSE,FALSE,FALSE,CHI: he looked at the clock .,TRUE,TRUE,TRUE,TRUE
in,FALSE,FALSE,FALSE,FALSE,CHI: <then he then he then he um> [/?] then he spilled <all> [/?] almost all of the milk that he had poured in the bowl .,TRUE,TRUE,TRUE,TRUE
out,FALSE,FALSE,FALSE,FALSE,INV: mhm .,TRUE,TRUE,TRUE,TRUE
in,FALSE,FALSE,FALSE,FALSE,CHI: and then he hadta clean it up .,TRUE,TRUE,TRUE,TRUE
in,FALSE,FALSE,FALSE,TRUE,CHI: next he went upstairs and got dressed .,TRUE,TRUE,TRUE,TRUE
in,FALSE,TRUE,FALSE,FALSE,CHI: <and> [>] then <&~h> [/?] he started to tie his shoe .,TRUE,TRUE,TRUE,TRUE
out,FALSE,FALSE,FALSE,FALSE,INV: <mhm> [<] .,TRUE,TRUE,TRUE,TRUE
in,FALSE,FALSE,FALSE,FALSE,CHI: <he &~w> [/?] he was tying his shoe when all of a sudden the string broke .,TRUE,TRUE,TRUE,TRUE
in,FALSE,FALSE,FALSE,FALSE,CHI: and then <he like> [/?] he hadta tie it with a little tiny weeny string .,TRUE,TRUE,TRUE,TRUE
out,FALSE,FALSE,FALSE,FALSE,INV: mhm .,TRUE,TRUE,TRUE,TRUE
in,FALSE,FALSE,FALSE,FALSE,CHI: and then he was all ready to go .,TRUE,TRUE,TRUE,TRUE
in,FALSE,FALSE,FALSE,FALSE,CHI: and then he missed the bus .,TRUE,TRUE,TRUE,TRUE
in,FALSE,FALSE,FALSE,FALSE,CHI: so he hadta walk all the way to school .,TRUE,TRUE,TRUE,TRUE
in,FALSE,FALSE,FALSE,FALSE,CHI: and then when he gotta school he saw his teacher outside .,TRUE,TRUE,TRUE,TRUE
in,FALSE,FALSE,FALSE,FALSE,CHI: and he was tardy .,TRUE,TRUE,TRUE,TRUE
in,FALSE,FALSE,TRUE,FALSE,CHI: so Ron was really having a bad day .,TRUE,TRUE,TRUE,TRUE
out,FALSE,FALSE,FALSE,FALSE,INV: you looking at the picture ?,FALSE,TRUE,FALSE,TRUE
in,TRUE,FALSE,FALSE,FALSE,CHI: the boy's name is gonna be David .,TRUE,TRUE,TRUE,TRUE
out,FALSE,FALSE,FALSE,FALSE,INV: mhm .,TRUE,TRUE,TRUE,TRUE
in,FALSE,FALSE,FALSE,TRUE,CHI: the girl's name is gonna be lily .,TRUE,TRUE,TRUE,TRUE
out,FALSE,FALSE,FALSE,FALSE,INV: okay .,TRUE,FALSE,FALSE,TRUE
out,FALSE,FALSE,FALSE,FALSE,CHI: lily not xxx .,TRUE,FALSE,FALSE,TRUE
in,FALSE,TRUE,FALSE,FALSE,CHI: <David and xxx xxx lily> [/?] David and lily were walking in the park .,TRUE,TRUE,TRUE,TRUE
in,FALSE,FALSE,FALSE,FALSE,CHI: and they saw a big saucer coming .,TRUE,TRUE,TRUE,TRUE
out,FALSE,FALSE,FALSE,FALSE,CHI: um I forgot his name already .,TRUE,TRUE,TRUE,TRUE
in,FALSE,FALSE,FALSE,FALSE,CHI: <David> [/?] &*INV:mhm David said look at that saucer .,TRUE,TRUE,TRUE,TRUE
out,FALSE,FALSE,FALSE,FALSE,INV: <mhm> [<] .,TRUE,TRUE,TRUE,TRUE
in,FALSE,FALSE,FALSE,FALSE,CHI: <so &~l> [/?] so lily look at that saucer .,TRUE,TRUE,TRUE,TRUE
in,FALSE,FALSE,FALSE,FALSE,CHI: they thought it could be <like> [/?] a big meteorite instead .,TRUE,TRUE,TRUE,TRUE
in,FALSE,FALSE,FALSE,FALSE,CHI: it started slowing down when it came to the earth .,TRUE,TRUE,TRUE,TRUE
out,FALSE,FALSE,FALSE,FALSE,INV: mhm .,TRUE,TRUE,TRUE,TRUE
in,FALSE,FALSE,FALSE,FALSE,CHI: then it came down <and landed> [/] and landed on the earth .,TRUE,TRUE,TRUE,TRUE
in,FALSE,FALSE,FALSE,TRUE,CHI: and then <a door> [/] a door came flying down .,TRUE,TRUE,TRUE,TRUE
in,FALSE,TRUE,FALSE,FALSE,CHI: then David and lily knew that it was an alien <&~saush> [/?] saucer .,TRUE,TRUE,TRUE,TRUE
in,FALSE,FALSE,FALSE,TRUE,CHI: <so then they> [/] so then they <went and> [/] went and hid behind some <brushes> [/?] brushy bushes and <&~pee> [/?] peered over the top .,TRUE,TRUE,TRUE,TRUE
in,FALSE,TRUE,FALSE,FALSE,CHI: and [/] and they saw the door open .,TRUE,TRUE,TRUE,TRUE
in,FALSE,FALSE,FALSE,FALSE,CHI: and then they saw these little figures coming out .,TRUE,TRUE,TRUE,TRUE
in,FALSE,FALSE,FALSE,FALSE,CHI: they saw one leg two leg three legs four legs five legs <&~a> [/?] lots_of legs coming out_of the things .,TRUE,TRUE,TRUE,TRUE
in,FALSE,FALSE,FALSE,FALSE,CHI: they knew that it would be alien .,TRUE,TRUE,TRUE,TRUE
in,FALSE,FALSE,FALSE,FALSE,CHI: &-um so the aliens +...,TRUE,TRUE,TRUE,TRUE
in,FALSE,FALSE,FALSE,TRUE,CHI: so they hid because they have all these little dots over them .,TRUE,TRUE,TRUE,TRUE
in,FALSE,TRUE,FALSE,FALSE,CHI: and they look like chickenpox .,TRUE,TRUE,TRUE,TRUE
in,FALSE,FALSE,FALSE,TRUE,CHI: and they had this weird dog an alien dog .,TRUE,TRUE,TRUE,TRUE
in,FALSE,TRUE,FALSE,FALSE,CHI: and then they land .,TRUE,TRUE,TRUE,TRUE
in,FALSE,FALSE,FALSE,TRUE,CHI: and then lily started to run over to try to meet them .,TRUE,TRUE,TRUE,TRUE
in,FALSE,TRUE,FALSE,FALSE,CHI: but [/] but David said no wait they could hurt us .,TRUE,TRUE,TRUE,TRUE
in,FALSE,FALSE,FALSE,FALSE,CHI: they're not from our land .,TRUE,TRUE,TRUE,TRUE
in,FALSE,FALSE,FALSE,FALSE,CHI: they're from mars I think or from another galaxy .,TRUE,TRUE,TRUE,TRUE
in,FALSE,FALSE,FALSE,TRUE,CHI: so +...,TRUE,TRUE,TRUE,TRUE
in,FALSE,TRUE,FALSE,FALSE,CHI: <but Elaina didn't> [/?] but lily didn't pay any attention .,TRUE,TRUE,TRUE,TRUE
in,FALSE,FALSE,FALSE,TRUE,CHI: she just kept on trying to meet them .,TRUE,TRUE,TRUE,TRUE
in,FALSE,TRUE,FALSE,FALSE,CHI: <and then> [/] and then <Elaina finally> [/?] lily finally listened .,TRUE,TRUE,TRUE,TRUE
in,FALSE,FALSE,FALSE,TRUE,CHI: she didn't go to meet them because they looked weird .,TRUE,TRUE,TRUE,TRUE
in,FALSE,TRUE,FALSE,FALSE,CHI: but they had <good> [/?] nice smiles .,TRUE,TRUE,TRUE,TRUE
out,FALSE,FALSE,FALSE,FALSE,INV: mhm .,TRUE,TRUE,TRUE,TRUE
in,FALSE,FALSE,FALSE,FALSE,CHI: so then they went home .,TRUE,TRUE,TRUE,TRUE
in,FALSE,FALSE,FALSE,FALSE,CHI: <and so they> [/?] and so the next day they came back .,TRUE,TRUE,TRUE,TRUE
in,FALSE,FALSE,FALSE,TRUE,CHI: and the aliens also were still there .,TRUE,TRUE,TRUE,TRUE
in,FALSE,TRUE,FALSE,FALSE,CHI: and so they wondered why it would stay here .,TRUE,TRUE,TRUE,TRUE
in,FALSE,FALSE,FALSE,TRUE,CHI: and they wondered <where the people were where the> [/?] where the aliens were .,TRUE,TRUE,TRUE,TRUE
in,FALSE,TRUE,FALSE,FALSE,CHI: and they looked all around .,TRUE,TRUE,TRUE,TRUE
in,FALSE,FALSE,FALSE,FALSE,CHI: and then they finally saw that they were eating the picnic .,TRUE,TRUE,TRUE,TRUE
in,FALSE,FALSE,FALSE,TRUE,CHI: and then they [/] they watched them go and play on the playground .,TRUE,TRUE,TRUE,TRUE
in,FALSE,TRUE,FALSE,FALSE,CHI: and then they fell asleep .,TRUE,TRUE,TRUE,TRUE
in,FALSE,FALSE,FALSE,TRUE,CHI: so Elaina and David <&~l> [/?] looked in the alien saucer .,TRUE,TRUE,TRUE,TRUE
in,FALSE,TRUE,FALSE,FALSE,CHI: looked like nothing was there .,TRUE,TRUE,TRUE,TRUE
in,FALSE,FALSE,FALSE,FALSE,CHI: except on the other side there was probably something .,TRUE,TRUE,TRUE,TRUE
in,FALSE,FALSE,FALSE,FALSE,CHI: they went in and looked on the other side .,TRUE,TRUE,TRUE,TRUE
in,FALSE,FALSE,FALSE,FALSE,CHI: they saw that there was nothing .,TRUE,TRUE,TRUE,TRUE
in,FALSE,FALSE,FALSE,TRUE,CHI: and they saw this big red button .,TRUE,TRUE,TRUE,TRUE
in,FALSE,TRUE,FALSE,FALSE,CHI: <and so they> [/?] and then they saw all these weird <things> [/?] curves on the side .,TRUE,TRUE,TRUE,TRUE
in,FALSE,FALSE,FALSE,TRUE,CHI: <so they xxx> [/?] so they knew that at last they hadta push the red button <for the stuff> [/] for the stuff like the chair <to be um> [/?] to be and the guns and all the other stuff .,TRUE,TRUE,TRUE,TRUE
in,FALSE,TRUE,FALSE,FALSE,CHI: <&~s> [/?] and so_that they now roll why <that that &-um that> [/?] that's where <the> [/?] all the stuff went .,TRUE,TRUE,TRUE,TRUE
in,FALSE,FALSE,FALSE,TRUE,CHI: so now they know that <that> [/?] they're hiding it because they don't want anybody to take off in their ship while they're still here .,TRUE,TRUE,TRUE,TRUE
out,FALSE,FALSE,FALSE,FALSE,INV: mhm .,TRUE,FALSE,FALSE,TRUE
in,FALSE,TRUE,FALSE,FALSE,CHI: so that's why they hid it .,TRUE,TRUE,TRUE,TRUE
in,FALSE,FALSE,FALSE,FALSE,CHI: so then right when they got out they hid in the bushes again .,TRUE,TRUE,TRUE,TRUE
in,FALSE,FALSE,FALSE,TRUE,CHI: then they were starting to wake up .,TRUE,TRUE,TRUE,TRUE
in,FALSE,TRUE,FALSE,FALSE,CHI: and then they went back on their alien saucer and went back and got some drinks .,TRUE,TRUE,TRUE,TRUE
in,FALSE,FALSE,FALSE,FALSE,CHI: and [/] and then they came back out .,TRUE,TRUE,TRUE,TRUE
in,FALSE,FALSE,FALSE,TRUE,CHI: <and there> [/] and there they saw the weird dog again .,TRUE,TRUE,TRUE,TRUE
in,FALSE,TRUE,FALSE,FALSE,CHI: and there was many many many legs and those green spots on their faces .,TRUE,TRUE,TRUE,TRUE
in,FALSE,FALSE,FALSE,TRUE,CHI: <and then> [/] and then Elaina jumped up from behind the brush and started to run towards the aliens again .,TRUE,TRUE,TRUE,TRUE
in,FALSE,TRUE,FALSE,FALSE,CHI: but David said no no no no wait wait .,TRUE,TRUE,TRUE,TRUE
in,FALSE,FALSE,FALSE,TRUE,CHI: we don't know any of them .,TRUE,TRUE,TRUE,TRUE
in,FALSE,TRUE,FALSE,FALSE,CHI: and Elaina didn't pay any attention .,TRUE,TRUE,TRUE,TRUE
in,FALSE,FALSE,FALSE,FALSE,CHI: so she just kept on trying to meet them .,TRUE,TRUE,TRUE,TRUE
in,FALSE,FALSE,FALSE,TRUE,CHI: and then David pulled her back .,TRUE,TRUE,TRUE,TRUE
in,FALSE,TRUE,FALSE,FALSE,CHI: and she fell on her bottom .,TRUE,TRUE,TRUE,TRUE
in,FALSE,FALSE,FALSE,TRUE,CHI: so did David .,TRUE,TRUE,TRUE,TRUE
in,FALSE,TRUE,FALSE,FALSE,CHI: and then they went over and had a picnic .,TRUE,TRUE,TRUE,TRUE
in,FALSE,FALSE,FALSE,FALSE,CHI: and then they went back into the playground .,TRUE,TRUE,TRUE,TRUE
in,FALSE,FALSE,FALSE,FALSE,CHI: and they took a nap .,TRUE,TRUE,TRUE,TRUE
in,FALSE,FALSE,TRUE,TRUE,CHI: and they keeps on going over and over again .,TRUE,TRUE,TRUE,TRUE
out,FALSE,FALSE,FALSE,FALSE,CHI: and that's all .,FALSE,FALSE,FALSE,FALSE
