in/out/ambiguous,start_human,start_llm,end_human,end_llm,Transcript,story_seg_human,story_seg_llm,intersection,union
in,TRUE,TRUE,FALSE,FALSE,INV: before we talk about chess,TRUE,TRUE,TRUE,TRUE
in,FALSE,FALSE,FALSE,TRUE,INV: I'm going to ask you a few general questions .,TRUE,TRUE,TRUE,TRUE
in,FALSE,TRUE,TRUE,FALSE,INV: then you can ask me some questions,TRUE,TRUE,TRUE,TRUE
out,FALSE,FALSE,FALSE,FALSE,INV: do you have have any brothers or sisters ?,FALSE,TRUE,FALSE,TRUE
out,FALSE,FALSE,FALSE,FALSE,CHI: one sister .,FALSE,TRUE,FALSE,TRUE
out,FALSE,FALSE,FALSE,FALSE,INV: what's [^ ic] her name ?,FALSE,TRUE,FALSE,TRUE
out,FALSE,FALSE,FALSE,FALSE,CHI: molly .,FALSE,TRUE,FALSE,TRUE
out,FALSE,FALSE,FALSE,FALSE,INV: how old is molly ?,FALSE,TRUE,FALSE,TRUE
out,FALSE,FALSE,FALSE,FALSE,CHI: uhm ten .,FALSE,TRUE,FALSE,TRUE
out,FALSE,FALSE,FALSE,FALSE,INV: what else can you tell me about molly ?,FALSE,TRUE,FALSE,TRUE
out,FALSE,FALSE,FALSE,FALSE,CHI: her birthday is [^ ic] january seven,FALSE,TRUE,FALSE,TRUE
out,FALSE,FALSE,FALSE,FALSE,CHI: that is [^ ic] it .,FALSE,TRUE,FALSE,TRUE
out,FALSE,FALSE,FALSE,FALSE,INV: do you have any pets at home ?,FALSE,TRUE,FALSE,TRUE
out,FALSE,FALSE,FALSE,FALSE,CHI: uhm molly has [^ ic] one goldfish .,FALSE,TRUE,FALSE,TRUE
out,FALSE,FALSE,FALSE,FALSE,INV: do you have a favorite tv show or movie ?,FALSE,TRUE,FALSE,TRUE
out,FALSE,FALSE,FALSE,FALSE,CHI: uhm not really .,FALSE,TRUE,FALSE,TRUE
out,FALSE,FALSE,FALSE,FALSE,INV: do you like to read books or magazines ?,FALSE,TRUE,FALSE,TRUE
out,FALSE,FALSE,FALSE,FALSE,CHI: uhm sometimes .,FALSE,TRUE,FALSE,TRUE
out,FALSE,FALSE,FALSE,FALSE,INV: which ones ?,FALSE,TRUE,FALSE,TRUE
out,FALSE,FALSE,FALSE,FALSE,CHI: uhm I do not [^ ic] really have a favorite .,FALSE,TRUE,FALSE,TRUE
out,FALSE,FALSE,FALSE,FALSE,INV: now do you want to ask me anything ?,FALSE,TRUE,FALSE,TRUE
out,FALSE,FALSE,FALSE,FALSE,CHI: no .,FALSE,TRUE,FALSE,TRUE
out,FALSE,FALSE,FALSE,FALSE,INV: now I'd like to ask you about chess .,FALSE,TRUE,FALSE,TRUE
out,FALSE,FALSE,FALSE,FALSE,INV: how long have you played chess ?,FALSE,TRUE,FALSE,TRUE
out,FALSE,FALSE,FALSE,FALSE,CHI: uhm nine months or a year .,FALSE,TRUE,FALSE,TRUE
out,FALSE,FALSE,FALSE,FALSE,INV: how old were you when you first started to play ?,FALSE,TRUE,FALSE,TRUE
out,FALSE,FALSE,FALSE,FALSE,CHI: six .,FALSE,TRUE,FALSE,TRUE
out,FALSE,FALSE,FALSE,FALSE,INV: who taught you how to play chess ?,FALSE,TRUE,FALSE,TRUE
out,FALSE,FALSE,FALSE,FALSE,CHI: uhm my dad I think [^ ic] .,FALSE,TRUE,FALSE,TRUE
out,FALSE,FALSE,FALSE,FALSE,INV: do you have a chess rating ?,FALSE,TRUE,FALSE,TRUE
out,FALSE,FALSE,FALSE,FALSE,CHI: yeah .,FALSE,TRUE,FALSE,TRUE
out,FALSE,FALSE,FALSE,FALSE,INV: what's your rating ?,FALSE,TRUE,FALSE,TRUE
out,FALSE,FALSE,FALSE,FALSE,CHI: seven+hundred+forty .,FALSE,TRUE,FALSE,TRUE
out,FALSE,FALSE,FALSE,FALSE,INV: is that pretty good ?,FALSE,TRUE,FALSE,TRUE
out,FALSE,FALSE,FALSE,FALSE,CHI: yeah .,FALSE,TRUE,FALSE,TRUE
out,FALSE,FALSE,FALSE,FALSE,INV: do you have a chess coach or teacher ?,FALSE,TRUE,FALSE,TRUE
out,FALSE,FALSE,FALSE,FALSE,CHI: yeah .,FALSE,TRUE,FALSE,TRUE
out,FALSE,FALSE,FALSE,FALSE,INV: is it a male or female ?,FALSE,TRUE,FALSE,TRUE
in,TRUE,FALSE,FALSE,TRUE,CHI: male .,TRUE,TRUE,TRUE,TRUE
out,FALSE,FALSE,FALSE,FALSE,INV: what's his name ?,TRUE,FALSE,FALSE,TRUE
in,FALSE,TRUE,FALSE,FALSE,CHI: jerry ramie .,TRUE,TRUE,TRUE,TRUE
out,FALSE,FALSE,FALSE,FALSE,INV: do you belong to a chess club ?,TRUE,TRUE,TRUE,TRUE
out,FALSE,FALSE,FALSE,FALSE,CHI: yeah .,TRUE,TRUE,TRUE,TRUE
out,FALSE,FALSE,FALSE,FALSE,INV: can you tell me about jerry ramie and how he coaches you in the chess club ?,TRUE,TRUE,TRUE,TRUE
out,FALSE,FALSE,FALSE,FALSE,CHI: alright,TRUE,TRUE,TRUE,TRUE
in,FALSE,FALSE,FALSE,TRUE,CHI: but he does not really do [^ ic] it there .,TRUE,TRUE,TRUE,TRUE
out,FALSE,FALSE,FALSE,FALSE,INV: tell me about him .,TRUE,FALSE,FALSE,TRUE
in,FALSE,TRUE,TRUE,FALSE,CHI: uhm I think he has been the worlds uhm xxx uhm .,TRUE,TRUE,TRUE,TRUE
out,FALSE,FALSE,FALSE,FALSE,CHI: that is it .,FALSE,TRUE,FALSE,TRUE
out,FALSE,FALSE,FALSE,FALSE,INV: is that it ?,FALSE,TRUE,FALSE,TRUE
out,FALSE,FALSE,FALSE,FALSE,INV: what about your chess club,FALSE,TRUE,FALSE,TRUE
in,TRUE,FALSE,FALSE,TRUE,CHI: uhm ridgeline chess club .,TRUE,TRUE,TRUE,TRUE
out,FALSE,FALSE,FALSE,FALSE,CHI: uhm yeah .,TRUE,FALSE,FALSE,TRUE
out,FALSE,FALSE,FALSE,FALSE,INV: how often do you play chess,TRUE,FALSE,FALSE,TRUE
in,FALSE,TRUE,FALSE,FALSE,CHI: sometimes monday,TRUE,TRUE,TRUE,TRUE
in,FALSE,FALSE,FALSE,TRUE,INV: so six days out of seven .,TRUE,TRUE,TRUE,TRUE
out,FALSE,FALSE,FALSE,FALSE,INV: that's good .,TRUE,FALSE,FALSE,TRUE
in,FALSE,TRUE,FALSE,FALSE,CHI: I played [^ ic] yesterday .,TRUE,TRUE,TRUE,TRUE
in,FALSE,FALSE,FALSE,TRUE,CHI: sometimes on monday I go [^ ic] to soccer .,TRUE,TRUE,TRUE,TRUE
in,FALSE,TRUE,TRUE,FALSE,INV: you're pretty busy .,TRUE,TRUE,TRUE,TRUE
out,FALSE,FALSE,FALSE,FALSE,INV: who do you play with the most ?,FALSE,TRUE,FALSE,TRUE
out,FALSE,FALSE,FALSE,FALSE,CHI: at school ?,FALSE,TRUE,FALSE,TRUE
in,TRUE,FALSE,FALSE,TRUE,INV: when you play on monday,TRUE,TRUE,TRUE,TRUE
in,FALSE,TRUE,TRUE,FALSE,CHI: uhm Monday's I usually play [^ ic] with isaac xxx .,TRUE,TRUE,TRUE,TRUE
out,FALSE,FALSE,FALSE,FALSE,INV: is he in the chess club ?,FALSE,TRUE,FALSE,TRUE
out,FALSE,FALSE,FALSE,FALSE,CHI: yeah .,FALSE,TRUE,FALSE,TRUE
out,FALSE,FALSE,FALSE,FALSE,INV: so you play with mainly your chess club members ?,FALSE,TRUE,FALSE,TRUE
in,FALSE,FALSE,FALSE,TRUE,CHI: yeah on tuesday's ian .,FALSE,TRUE,FALSE,TRUE
in,FALSE,TRUE,FALSE,FALSE,INV: on monday's isaac,FALSE,TRUE,FALSE,TRUE
in,FALSE,FALSE,FALSE,TRUE,CHI: sometimes .,FALSE,TRUE,FALSE,TRUE
out,FALSE,FALSE,FALSE,FALSE,INV: is ian in the chess club ?,FALSE,FALSE,FALSE,FALSE
in,FALSE,TRUE,FALSE,FALSE,CHI: no xxx with jerry .,FALSE,TRUE,FALSE,TRUE
in,FALSE,FALSE,FALSE,TRUE,CHI: xxx and isaac xxx and sometimes I play [^ ic] with jerry .,FALSE,TRUE,FALSE,TRUE
out,FALSE,FALSE,FALSE,FALSE,INV: did you beat him ?,FALSE,FALSE,FALSE,FALSE
in,FALSE,TRUE,TRUE,FALSE,CHI: second to last time I played [^ rc] him I beat [^ ic] him .,FALSE,TRUE,FALSE,TRUE
out,FALSE,FALSE,FALSE,FALSE,INV: you're pretty good .,FALSE,TRUE,FALSE,TRUE
out,FALSE,FALSE,FALSE,FALSE,CHI: I know .,FALSE,TRUE,FALSE,TRUE
out,FALSE,FALSE,FALSE,FALSE,INV: can you name any famous chess players ?,FALSE,TRUE,FALSE,TRUE
out,FALSE,FALSE,FALSE,FALSE,CHI: bobby fisher .,FALSE,TRUE,FALSE,TRUE
out,FALSE,FALSE,FALSE,FALSE,INV: can you tell me something about bobby fisher ?,FALSE,TRUE,FALSE,TRUE
out,FALSE,FALSE,FALSE,FALSE,CHI: uhm he used to be [^ ic] the worlds best chess player xxx .,FALSE,TRUE,FALSE,TRUE
out,FALSE,FALSE,FALSE,FALSE,INV: do you ever play chess on a computer ?,FALSE,TRUE,FALSE,TRUE
out,FALSE,FALSE,FALSE,FALSE,CHI: no .,FALSE,TRUE,FALSE,TRUE
out,FALSE,FALSE,FALSE,FALSE,INV: now tell me why you enjoy chess .,FALSE,TRUE,FALSE,TRUE
out,FALSE,FALSE,FALSE,FALSE,CHI: uhm I do not know,FALSE,TRUE,FALSE,TRUE
out,FALSE,FALSE,FALSE,FALSE,INV: I'm not too familiar with the game of chess .,FALSE,TRUE,FALSE,TRUE
out,FALSE,FALSE,FALSE,FALSE,INV: you probably know a lot more about it than I do .,FALSE,TRUE,FALSE,TRUE
out,FALSE,FALSE,FALSE,FALSE,INV: so I'd like you to explain some things to me .,FALSE,TRUE,FALSE,TRUE
out,FALSE,FALSE,FALSE,FALSE,INV: first of all,FALSE,TRUE,FALSE,TRUE
out,FALSE,FALSE,FALSE,FALSE,CHI: uhm four .,FALSE,TRUE,FALSE,TRUE
out,FALSE,FALSE,FALSE,FALSE,CHI: not on one board,FALSE,TRUE,FALSE,TRUE
out,FALSE,FALSE,FALSE,FALSE,CHI: and xxx wait I forget what that is [^ ic] called .,FALSE,TRUE,FALSE,TRUE
out,FALSE,FALSE,FALSE,FALSE,INV: I've heard of simultaneous matches .,FALSE,TRUE,FALSE,TRUE
out,FALSE,FALSE,FALSE,FALSE,CHI: that is what that is [^ ic] called xxx .,FALSE,TRUE,FALSE,TRUE
out,FALSE,FALSE,FALSE,FALSE,INV: tell me about the different pieces and how they are supposed to move .,FALSE,TRUE,FALSE,TRUE
out,FALSE,FALSE,FALSE,FALSE,CHI: so,FALSE,TRUE,FALSE,TRUE
out,FALSE,FALSE,FALSE,FALSE,INV: do they go straight ahead or diagonal ?,FALSE,TRUE,FALSE,TRUE
in,TRUE,FALSE,FALSE,TRUE,CHI: not diagonal,TRUE,TRUE,TRUE,TRUE
in,FALSE,TRUE,FALSE,FALSE,INV: like an l shape .,TRUE,TRUE,TRUE,TRUE
in,FALSE,FALSE,FALSE,FALSE,CHI: and bishops can go [^ ic] diagonal .,TRUE,TRUE,TRUE,TRUE
in,FALSE,FALSE,FALSE,FALSE,CHI: and on your first move with a pawn,TRUE,TRUE,TRUE,TRUE
in,FALSE,FALSE,FALSE,TRUE,CHI: but the rest you have to go [^ ic] one .,TRUE,TRUE,TRUE,TRUE
out,FALSE,FALSE,FALSE,FALSE,INV: your first move you can move two spaces ?,TRUE,FALSE,FALSE,TRUE
out,FALSE,FALSE,FALSE,FALSE,CHI: yeah,TRUE,FALSE,FALSE,TRUE
in,FALSE,TRUE,FALSE,FALSE,CHI: and kings one space any direction .,TRUE,TRUE,TRUE,TRUE
in,FALSE,FALSE,FALSE,FALSE,CHI: and the queen all through the board any direction .,TRUE,TRUE,TRUE,TRUE
in,FALSE,FALSE,FALSE,FALSE,CHI: and with the knights xxx .,TRUE,TRUE,TRUE,TRUE
out,FALSE,FALSE,FALSE,FALSE,INV: the little short pieces ?,TRUE,TRUE,TRUE,TRUE
in,FALSE,FALSE,FALSE,FALSE,CHI: alright and knights can jump [^ ic] other pieces .,TRUE,TRUE,TRUE,TRUE
in,FALSE,FALSE,TRUE,FALSE,CHI: xxx and knights xxx .,TRUE,TRUE,TRUE,TRUE
out,FALSE,FALSE,FALSE,FALSE,INV: now tell me about the goals of chess .,FALSE,TRUE,FALSE,TRUE
out,FALSE,FALSE,FALSE,FALSE,INV: in other words,FALSE,TRUE,FALSE,TRUE
out,FALSE,FALSE,FALSE,FALSE,CHI: uhm capture the king and checkmate .,FALSE,TRUE,FALSE,TRUE
out,FALSE,FALSE,FALSE,FALSE,INV: now tell me the rules that players need to follow .,FALSE,TRUE,FALSE,TRUE
out,FALSE,FALSE,FALSE,FALSE,INV: in other words,FALSE,TRUE,FALSE,TRUE
in,TRUE,FALSE,FALSE,FALSE,CHI: uhm there is touch rule xxx .,TRUE,TRUE,TRUE,TRUE
in,FALSE,FALSE,FALSE,FALSE,CHI: and so if you touch a piece you have [^ ic] to play .,TRUE,TRUE,TRUE,TRUE
in,FALSE,FALSE,TRUE,FALSE,CHI: xxx and you touch another piece if its legal you have [^ ic] to take it .,TRUE,TRUE,TRUE,TRUE
out,FALSE,FALSE,FALSE,FALSE,CHI: uhm that is [^ ic] all I can think of right now .,FALSE,TRUE,FALSE,TRUE
out,FALSE,FALSE,FALSE,FALSE,INV: those are pretty important rules aren't they ?,FALSE,TRUE,FALSE,TRUE
out,FALSE,FALSE,FALSE,FALSE,CHI: yeah .,FALSE,TRUE,FALSE,TRUE
out,FALSE,FALSE,FALSE,FALSE,INV: now I would like you to tell me what a player should do in order to win the game of chess .,FALSE,TRUE,FALSE,TRUE
out,FALSE,FALSE,FALSE,FALSE,INV: in other words,FALSE,TRUE,FALSE,TRUE
in,TRUE,FALSE,FALSE,FALSE,CHI: if you get [^ avc] your pawn down to the other side,TRUE,TRUE,TRUE,TRUE
in,FALSE,FALSE,FALSE,FALSE,CHI: but it doesn't it cannot be [^ ic] a pawn .,TRUE,TRUE,TRUE,TRUE
in,FALSE,FALSE,FALSE,FALSE,CHI: or it cannot be [^ ic] a king .,TRUE,TRUE,TRUE,TRUE
in,FALSE,FALSE,FALSE,FALSE,CHI: if you get [^ avc] your pawn down to the other side without being taken,TRUE,TRUE,TRUE,TRUE
in,FALSE,FALSE,FALSE,FALSE,CHI: and you can have [^ ic] two queens on the board .,TRUE,TRUE,TRUE,TRUE
out,FALSE,FALSE,FALSE,FALSE,INV: is that a good strategy ?,TRUE,TRUE,TRUE,TRUE
out,FALSE,FALSE,FALSE,FALSE,CHI: yeah .,TRUE,TRUE,TRUE,TRUE
in,FALSE,FALSE,FALSE,FALSE,CHI: and uhm if you do not lose [^ avc] any of your pawns and you get them all down,TRUE,TRUE,TRUE,TRUE
in,FALSE,FALSE,FALSE,TRUE,CHI: and if you if you get [^ avc] a pawn down and you can flip one of the rooks over and that is [^ ic] a queen .,TRUE,TRUE,TRUE,TRUE
in,FALSE,TRUE,FALSE,FALSE,CHI: and you get another one down you can flip another rook over and then you got two queens .,TRUE,TRUE,TRUE,TRUE
in,FALSE,FALSE,FALSE,FALSE,CHI: and then xxx .,TRUE,TRUE,TRUE,TRUE
in,FALSE,FALSE,FALSE,TRUE,CHI: you get and then you get [^ ic] all seven pawns down you can have [^ ic] eleven queens .,TRUE,TRUE,TRUE,TRUE
out,FALSE,FALSE,FALSE,FALSE,INV: is that great ?,TRUE,FALSE,FALSE,TRUE
out,FALSE,FALSE,FALSE,FALSE,CHI: yeah .,TRUE,FALSE,FALSE,TRUE
in,FALSE,TRUE,FALSE,FALSE,CHI: but with two or one then you get [^ ic] checkmate .,TRUE,TRUE,TRUE,TRUE
in,FALSE,FALSE,TRUE,FALSE,CHI: you just have to get [^ ic] it to the side your on and then here is [^ ic] a king,TRUE,TRUE,TRUE,TRUE
out,FALSE,FALSE,FALSE,FALSE,INV: how long does it usually take to play a game of chess ?,FALSE,TRUE,FALSE,TRUE
in,TRUE,FALSE,FALSE,FALSE,CHI: uhm if an inexperienced player is [^ avc] playing,TRUE,TRUE,TRUE,TRUE
in,FALSE,FALSE,FALSE,FALSE,CHI: and an experienced player is [^ ic] playing it can go [^ ic] up to four hours at least .,TRUE,TRUE,TRUE,TRUE
out,FALSE,FALSE,FALSE,FALSE,INV: what makes a game last a long time ?,TRUE,TRUE,TRUE,TRUE
in,FALSE,FALSE,FALSE,FALSE,CHI: uhm not winning his pieces .,TRUE,TRUE,TRUE,TRUE
in,FALSE,FALSE,FALSE,FALSE,CHI: cause if you are [^ avc] winning his pieces,TRUE,TRUE,TRUE,TRUE
out,FALSE,FALSE,FALSE,FALSE,CHI: yeah .,TRUE,TRUE,TRUE,TRUE
out,FALSE,FALSE,FALSE,FALSE,INV: what makes a game end quickly be short ?,TRUE,TRUE,TRUE,TRUE
in,FALSE,FALSE,FALSE,FALSE,CHI: you lose your pieces very [^ ic] quickly .,TRUE,TRUE,TRUE,TRUE
in,FALSE,FALSE,FALSE,FALSE,CHI: and if you up pieces,TRUE,TRUE,TRUE,TRUE
out,FALSE,FALSE,FALSE,FALSE,INV: trading ?,TRUE,TRUE,TRUE,TRUE
in,FALSE,FALSE,FALSE,FALSE,CHI: take [^ ic] a bishop for a bishop xxx .,TRUE,TRUE,TRUE,TRUE
in,FALSE,FALSE,TRUE,FALSE,CHI: so you should do [^ ic] that if you are [^ avc] ahead of the game .,TRUE,TRUE,TRUE,TRUE
out,FALSE,FALSE,FALSE,FALSE,INV: do you know how to use a chess clock ?,FALSE,TRUE,FALSE,TRUE
out,FALSE,FALSE,FALSE,FALSE,CHI: child nods head .,FALSE,TRUE,FALSE,TRUE
out,FALSE,FALSE,FALSE,FALSE,INV: tell me about it .,FALSE,TRUE,FALSE,TRUE
in,TRUE,FALSE,FALSE,FALSE,CHI: uhm if it is your turn [^ avc] and you make a move,TRUE,TRUE,TRUE,TRUE
in,FALSE,FALSE,FALSE,TRUE,CHI: so then it will [^ ic] pop up a light or pop up something that will tell the other player .,TRUE,TRUE,TRUE,TRUE
in,FALSE,TRUE,FALSE,FALSE,CHI: and if they do not hit [^ avc] the clock,TRUE,TRUE,TRUE,TRUE
in,FALSE,FALSE,FALSE,FALSE,CHI: and if it goes out,TRUE,TRUE,TRUE,TRUE
in,FALSE,FALSE,TRUE,TRUE,CHI: if they do not say flag [^ avc] xxx .,TRUE,TRUE,TRUE,TRUE
out,FALSE,FALSE,FALSE,FALSE,INV: is there anything else you want to tell me about chess ?,FALSE,FALSE,FALSE,FALSE
in,TRUE,TRUE,FALSE,FALSE,CHI: uhm en passant .,TRUE,TRUE,TRUE,TRUE
out,FALSE,FALSE,FALSE,FALSE,INV: what is that ?,TRUE,TRUE,TRUE,TRUE
in,FALSE,FALSE,FALSE,FALSE,CHI: that is when you are [^ ic] in fifth rank .,TRUE,TRUE,TRUE,TRUE
in,FALSE,FALSE,FALSE,FALSE,CHI: and a pawn is here [^ ic] and another pawn here .,TRUE,TRUE,TRUE,TRUE
in,FALSE,FALSE,FALSE,FALSE,CHI: black pawn here [^ ic] xxx .,TRUE,TRUE,TRUE,TRUE
in,FALSE,FALSE,TRUE,TRUE,CHI: but originally xxx .,TRUE,TRUE,TRUE,TRUE
out,FALSE,FALSE,FALSE,FALSE,INV: anything else you want me to know about ?,FALSE,FALSE,FALSE,FALSE
out,FALSE,FALSE,FALSE,FALSE,CHI: nope .,FALSE,FALSE,FALSE,FALSE
