in/out/ambiguous,start_human,start_llm,end_human,end_llm,Transcript,story_seg_human,story_seg_llm,intersection,union
out,FALSE,FALSE,FALSE,FALSE,INV: &=intro .,FALSE,FALSE,FALSE,FALSE
out,FALSE,FALSE,FALSE,FALSE,INV: have you been to a farm ?,FALSE,FALSE,FALSE,FALSE
out,FALSE,FALSE,FALSE,FALSE,CHI: no .,FALSE,FALSE,FALSE,FALSE
out,FALSE,FALSE,FALSE,FALSE,INV: what kind of animals do you think you find on a farm ?,FALSE,FALSE,FALSE,FALSE
out,FALSE,FALSE,FALSE,FALSE,"CHI: &-um , cows .",FALSE,FALSE,FALSE,FALSE
out,FALSE,FALSE,FALSE,FALSE,INV: yeah .,FALSE,FALSE,FALSE,FALSE
out,FALSE,FALSE,FALSE,FALSE,CHI: and ducks .,FALSE,FALSE,FALSE,FALSE
out,FALSE,FALSE,FALSE,FALSE,INV: and horses .,FALSE,FALSE,FALSE,FALSE
out,FALSE,FALSE,FALSE,FALSE,CHI: and horses .,FALSE,FALSE,FALSE,FALSE
out,FALSE,FALSE,FALSE,FALSE,INV: what do you think he's doing ?,FALSE,FALSE,FALSE,FALSE
out,FALSE,FALSE,FALSE,FALSE,CHI: milking the cow .,FALSE,FALSE,FALSE,FALSE
out,FALSE,FALSE,FALSE,FALSE,INV: whoops .,FALSE,FALSE,FALSE,FALSE
out,FALSE,FALSE,FALSE,FALSE,CHI: came off .,FALSE,FALSE,FALSE,FALSE
out,FALSE,FALSE,FALSE,FALSE,INV: what are you doing in the hall today ?,FALSE,FALSE,FALSE,FALSE
in,TRUE,TRUE,FALSE,FALSE,CHI: practising for our play .,TRUE,TRUE,TRUE,TRUE
out,FALSE,FALSE,FALSE,FALSE,INV: what's your play ?,TRUE,TRUE,TRUE,TRUE
in,FALSE,FALSE,FALSE,FALSE,CHI: Pinochio .,TRUE,TRUE,TRUE,TRUE
out,FALSE,FALSE,FALSE,FALSE,INV: are you in it ?,TRUE,TRUE,TRUE,TRUE
out,FALSE,FALSE,FALSE,FALSE,CHI: yeah .,TRUE,TRUE,TRUE,TRUE
out,FALSE,FALSE,FALSE,FALSE,INV: what do you hafta do ?,TRUE,TRUE,TRUE,TRUE
in,FALSE,FALSE,FALSE,FALSE,CHI: I'm the talking cricket .,TRUE,TRUE,TRUE,TRUE
out,FALSE,FALSE,FALSE,FALSE,INV: what's that ?,TRUE,TRUE,TRUE,TRUE
in,FALSE,FALSE,FALSE,FALSE,CHI: it's this cricket who [/] who talks all the time .,TRUE,TRUE,TRUE,TRUE
out,FALSE,FALSE,FALSE,FALSE,INV: what does he say ?,TRUE,TRUE,TRUE,TRUE
out,FALSE,FALSE,FALSE,FALSE,INV: who does he talk to ?,TRUE,TRUE,TRUE,TRUE
in,FALSE,FALSE,TRUE,FALSE,CHI: Pinochio .,TRUE,TRUE,TRUE,TRUE
out,FALSE,FALSE,FALSE,FALSE,INV: is he Jiminy Cricket ?,FALSE,TRUE,FALSE,TRUE
out,FALSE,FALSE,FALSE,FALSE,CHI: yes .,FALSE,TRUE,FALSE,TRUE
out,FALSE,FALSE,FALSE,FALSE,INV: is that barn ?,FALSE,TRUE,FALSE,TRUE
out,FALSE,FALSE,FALSE,FALSE,CHI: yeah .,FALSE,TRUE,FALSE,TRUE
out,FALSE,FALSE,FALSE,FALSE,CHI: put some cows in the barn .,FALSE,TRUE,FALSE,TRUE
out,FALSE,FALSE,FALSE,FALSE,INV: good idea .,FALSE,TRUE,FALSE,TRUE
out,FALSE,FALSE,FALSE,FALSE,INV: who's going to come and see the play ?,FALSE,TRUE,FALSE,TRUE
in,TRUE,FALSE,FALSE,FALSE,CHI: our mums and dads .,TRUE,TRUE,TRUE,TRUE
out,FALSE,FALSE,FALSE,FALSE,INV: have you finished practising ?,TRUE,TRUE,TRUE,TRUE
out,FALSE,FALSE,FALSE,FALSE,CHI: yeah .,TRUE,TRUE,TRUE,TRUE
in,FALSE,FALSE,FALSE,FALSE,CHI: got two weeks .,TRUE,TRUE,TRUE,TRUE
in,FALSE,FALSE,FALSE,FALSE,CHI: and then we do it .,TRUE,TRUE,TRUE,TRUE
out,FALSE,FALSE,FALSE,FALSE,INV: is it difficult being a cricket ?,TRUE,TRUE,TRUE,TRUE
out,FALSE,FALSE,FALSE,FALSE,CHI: yeah .,TRUE,TRUE,TRUE,TRUE
out,FALSE,FALSE,FALSE,FALSE,INV: is it difficult ?,TRUE,TRUE,TRUE,TRUE
in,FALSE,FALSE,TRUE,FALSE,"CHI: yeah , sometimes it is .",TRUE,TRUE,TRUE,TRUE
out,FALSE,FALSE,FALSE,FALSE,INV: do you remember what you hafta say ?,FALSE,TRUE,FALSE,TRUE
out,FALSE,FALSE,FALSE,FALSE,CHI: yeah .,FALSE,TRUE,FALSE,TRUE
out,FALSE,FALSE,FALSE,FALSE,INV: did you have a christmas tree like that at home ?,FALSE,TRUE,FALSE,TRUE
out,FALSE,FALSE,FALSE,FALSE,CHI: yeah .,FALSE,TRUE,FALSE,TRUE
out,FALSE,FALSE,FALSE,FALSE,INV: what do you think that one is ?,FALSE,TRUE,FALSE,TRUE
out,FALSE,FALSE,FALSE,FALSE,CHI: 0 .,FALSE,TRUE,FALSE,TRUE
out,FALSE,FALSE,FALSE,FALSE,INV: probably a milk churn „ isn't it .,FALSE,TRUE,FALSE,TRUE
out,FALSE,FALSE,FALSE,FALSE,CHI: yeah .,FALSE,TRUE,FALSE,TRUE
out,FALSE,FALSE,FALSE,FALSE,INV: how many are there ?,FALSE,TRUE,FALSE,TRUE
in,TRUE,FALSE,FALSE,FALSE,CHI: one in the barn .,TRUE,TRUE,TRUE,TRUE
in,FALSE,FALSE,FALSE,TRUE,INV: what do you think that lady's going to do ?,TRUE,TRUE,TRUE,TRUE
in,FALSE,TRUE,FALSE,FALSE,CHI: feeding the cow .,TRUE,TRUE,TRUE,TRUE
out,FALSE,FALSE,FALSE,FALSE,INV: &-um .,TRUE,TRUE,TRUE,TRUE
in,FALSE,FALSE,FALSE,FALSE,CHI: she gonna feed the cow .,TRUE,TRUE,TRUE,TRUE
out,FALSE,FALSE,FALSE,FALSE,INV: what do cows eat ?,TRUE,TRUE,TRUE,TRUE
out,FALSE,FALSE,FALSE,FALSE,INV: do they eat hay or something ?,TRUE,TRUE,TRUE,TRUE
in,FALSE,FALSE,FALSE,FALSE,CHI: they eat hay .,TRUE,TRUE,TRUE,TRUE
out,FALSE,FALSE,FALSE,FALSE,INV: what's that ?,TRUE,TRUE,TRUE,TRUE
out,FALSE,FALSE,FALSE,FALSE,CHI: 0 .,TRUE,TRUE,TRUE,TRUE
out,FALSE,FALSE,FALSE,FALSE,INV: that's nice .,TRUE,TRUE,TRUE,TRUE
out,FALSE,FALSE,FALSE,FALSE,INV: where are we gonna put her ?,TRUE,TRUE,TRUE,TRUE
in,FALSE,FALSE,FALSE,TRUE,CHI: could try and fit her in there .,TRUE,TRUE,TRUE,TRUE
in,FALSE,TRUE,FALSE,FALSE,INV: if we move this .,TRUE,TRUE,TRUE,TRUE
in,FALSE,FALSE,FALSE,TRUE,CHI: up to there .,TRUE,TRUE,TRUE,TRUE
out,FALSE,FALSE,FALSE,FALSE,INV: yeah .,TRUE,FALSE,FALSE,TRUE
in,FALSE,TRUE,TRUE,FALSE,CHI: and they move down to there .,TRUE,TRUE,TRUE,TRUE
out,FALSE,FALSE,FALSE,FALSE,INV: is there room now ?,FALSE,TRUE,FALSE,TRUE
out,FALSE,FALSE,FALSE,FALSE,CHI: yeah .,FALSE,TRUE,FALSE,TRUE
out,FALSE,FALSE,FALSE,FALSE,INV: I'd love to go in windmill .,FALSE,TRUE,FALSE,TRUE
out,FALSE,FALSE,FALSE,FALSE,CHI: so would I .,FALSE,TRUE,FALSE,TRUE
out,FALSE,FALSE,FALSE,FALSE,INV: have you ever ridden a horse ?,FALSE,TRUE,FALSE,TRUE
in,TRUE,FALSE,FALSE,TRUE,"CHI: yeah , I rode on a pony .",TRUE,TRUE,TRUE,TRUE
in,FALSE,TRUE,TRUE,FALSE,CHI: and xxx was in a big horse .,TRUE,TRUE,TRUE,TRUE
out,FALSE,FALSE,FALSE,FALSE,INV: wasn't it scary on a big horse ?,FALSE,TRUE,FALSE,TRUE
out,FALSE,FALSE,FALSE,FALSE,CHI: no .,FALSE,TRUE,FALSE,TRUE
out,FALSE,FALSE,FALSE,FALSE,INV: where did you do that ?,FALSE,TRUE,FALSE,TRUE
out,FALSE,FALSE,FALSE,FALSE,CHI: 0 .,FALSE,TRUE,FALSE,TRUE
out,FALSE,FALSE,FALSE,FALSE,INV: on holiday ?,FALSE,TRUE,FALSE,TRUE
out,FALSE,FALSE,FALSE,FALSE,CHI: yeah .,FALSE,TRUE,FALSE,TRUE
in,TRUE,FALSE,FALSE,TRUE,CHI: on our holiday this man came with <lit two> [//] two little monkeys and a camera .,TRUE,TRUE,TRUE,TRUE
in,FALSE,TRUE,FALSE,FALSE,"CHI: and me and my big sister , Kate , we held the monkeys .",TRUE,TRUE,TRUE,TRUE
in,FALSE,FALSE,FALSE,FALSE,CHI: and the monkeys had a little of xxx .,TRUE,TRUE,TRUE,TRUE
in,FALSE,FALSE,FALSE,TRUE,CHI: and he took a picture of us .,TRUE,TRUE,TRUE,TRUE
out,FALSE,FALSE,FALSE,FALSE,"INV: how big were they , the monkeys ?",TRUE,FALSE,FALSE,TRUE
in,FALSE,TRUE,FALSE,FALSE,CHI: only that big (be)cause they were little baby ones .,TRUE,TRUE,TRUE,TRUE
in,FALSE,FALSE,TRUE,TRUE,INV: they didn't bite you .,TRUE,TRUE,TRUE,TRUE
out,FALSE,FALSE,FALSE,FALSE,CHI: no .,FALSE,FALSE,FALSE,FALSE
out,FALSE,FALSE,FALSE,FALSE,INV: what else did you do on holiday ?,FALSE,FALSE,FALSE,FALSE
in,TRUE,TRUE,FALSE,FALSE,CHI: went to some shops and bought some things .,TRUE,TRUE,TRUE,TRUE
out,FALSE,FALSE,FALSE,FALSE,INV: where did you go for your holidays ?,TRUE,TRUE,TRUE,TRUE
in,FALSE,FALSE,FALSE,FALSE,CHI: St .,TRUE,TRUE,TRUE,TRUE
in,FALSE,FALSE,TRUE,TRUE,CHI: Ives .,TRUE,TRUE,TRUE,TRUE
out,FALSE,FALSE,FALSE,FALSE,INV: what's he gonna cut down ?,FALSE,FALSE,FALSE,FALSE
out,FALSE,FALSE,FALSE,FALSE,CHI: these pieces of wood can go there .,FALSE,FALSE,FALSE,FALSE
out,FALSE,FALSE,FALSE,FALSE,INV: how old is your sister ?,FALSE,FALSE,FALSE,FALSE
in,TRUE,TRUE,FALSE,FALSE,"CHI: &-um , thirteen .",TRUE,TRUE,TRUE,TRUE
out,FALSE,FALSE,FALSE,FALSE,INV: is she in this school ?,TRUE,TRUE,TRUE,TRUE
in,FALSE,FALSE,FALSE,TRUE,"CHI: no , <she's in> [/] she's in St .",TRUE,TRUE,TRUE,TRUE
in,FALSE,TRUE,FALSE,FALSE,CHI: John Bosters' .,TRUE,TRUE,TRUE,TRUE
in,FALSE,FALSE,FALSE,TRUE,CHI: got another sister call [=? called] Julie .,TRUE,TRUE,TRUE,TRUE
in,FALSE,TRUE,FALSE,FALSE,CHI: and she's in St .,TRUE,TRUE,TRUE,TRUE
in,FALSE,FALSE,FALSE,TRUE,CHI: John Bosters' .,TRUE,TRUE,TRUE,TRUE
in,FALSE,TRUE,FALSE,FALSE,CHI: and <our Julie's> [/] our Julie [=? Julie's] sixteen .,TRUE,TRUE,TRUE,TRUE
in,FALSE,FALSE,TRUE,FALSE,CHI: soon she'll be seventeen .,TRUE,TRUE,TRUE,TRUE
out,FALSE,FALSE,FALSE,FALSE,INV: is she still at school ?,FALSE,TRUE,FALSE,TRUE
out,FALSE,FALSE,FALSE,FALSE,CHI: what ?,FALSE,TRUE,FALSE,TRUE
out,FALSE,FALSE,FALSE,FALSE,INV: isn't she leaving school soon ?,FALSE,TRUE,FALSE,TRUE
out,FALSE,FALSE,FALSE,FALSE,CHI: yeah .,FALSE,TRUE,FALSE,TRUE
in,TRUE,FALSE,FALSE,TRUE,CHI: on saturdays she goes to Woolworth's .,TRUE,TRUE,TRUE,TRUE
out,FALSE,FALSE,FALSE,FALSE,INV: what does she do there ?,TRUE,FALSE,FALSE,TRUE
in,FALSE,TRUE,TRUE,FALSE,CHI: she works with my aunty and my other aunty .,TRUE,TRUE,TRUE,TRUE
out,FALSE,FALSE,FALSE,FALSE,INV: is it nice having two big sisters ?,FALSE,TRUE,FALSE,TRUE
out,FALSE,FALSE,FALSE,FALSE,CHI: yeah .,FALSE,TRUE,FALSE,TRUE
out,FALSE,FALSE,FALSE,FALSE,INV: do you play with them ?,FALSE,TRUE,FALSE,TRUE
out,FALSE,FALSE,FALSE,FALSE,"CHI: yeah , sometimes .",FALSE,TRUE,FALSE,TRUE
in,TRUE,FALSE,FALSE,TRUE,CHI: sometimes they've gotta do their projects .,TRUE,TRUE,TRUE,TRUE
in,FALSE,TRUE,TRUE,FALSE,INV: so they're too busy .,TRUE,TRUE,TRUE,TRUE
out,FALSE,FALSE,FALSE,FALSE,"CHI: yeah , sometimes .",FALSE,TRUE,FALSE,TRUE
out,FALSE,FALSE,FALSE,FALSE,INV: don't you ever fight with them ?,FALSE,TRUE,FALSE,TRUE
in,TRUE,FALSE,FALSE,TRUE,CHI: once we had a fight .,TRUE,TRUE,TRUE,TRUE
in,FALSE,TRUE,TRUE,FALSE,CHI: but we don't fight any more .,TRUE,TRUE,TRUE,TRUE
out,FALSE,FALSE,FALSE,FALSE,INV: there's the milkman .,FALSE,TRUE,FALSE,TRUE
out,FALSE,FALSE,FALSE,FALSE,INV: that's the man with the brown suit on .,FALSE,TRUE,FALSE,TRUE
out,FALSE,FALSE,FALSE,FALSE,INV: this is the man who's kneeling down .,FALSE,TRUE,FALSE,TRUE
out,FALSE,FALSE,FALSE,FALSE,INV: that's the postman .,FALSE,TRUE,FALSE,TRUE
in,TRUE,FALSE,FALSE,TRUE,CHI: postman .,TRUE,TRUE,TRUE,TRUE
out,FALSE,FALSE,FALSE,FALSE,INV: has he just been to the house or is he just coming ?,TRUE,FALSE,FALSE,TRUE
in,FALSE,TRUE,FALSE,FALSE,CHI: just coming .,TRUE,TRUE,TRUE,TRUE
out,FALSE,FALSE,FALSE,FALSE,INV: what's he going to do ?,TRUE,TRUE,TRUE,TRUE
in,FALSE,FALSE,TRUE,TRUE,CHI: gonna post a letter in the letter box .,TRUE,TRUE,TRUE,TRUE
out,FALSE,FALSE,FALSE,FALSE,INV: what's next ?,FALSE,FALSE,FALSE,FALSE
in,TRUE,TRUE,FALSE,FALSE,CHI: milkman .,TRUE,TRUE,TRUE,TRUE
in,FALSE,FALSE,FALSE,TRUE,INV: he's just been as_well .,TRUE,TRUE,TRUE,TRUE
in,FALSE,TRUE,TRUE,FALSE,"CHI: yeah , and he's going .",TRUE,TRUE,TRUE,TRUE
out,FALSE,FALSE,FALSE,FALSE,INV: what's next ?,FALSE,TRUE,FALSE,TRUE
in,TRUE,FALSE,FALSE,FALSE,CHI: man with the brown suit on .,TRUE,TRUE,TRUE,TRUE
out,FALSE,FALSE,FALSE,FALSE,INV: who do you think he is ?,TRUE,TRUE,TRUE,TRUE
in,FALSE,FALSE,FALSE,FALSE,"CHI: &-um , an office man .",TRUE,TRUE,TRUE,TRUE
in,FALSE,FALSE,TRUE,FALSE,INV: he's going to work .,TRUE,TRUE,TRUE,TRUE
out,FALSE,FALSE,FALSE,FALSE,CHI: yeah .,FALSE,TRUE,FALSE,TRUE
out,FALSE,FALSE,FALSE,FALSE,CHI: if I put him there coming out .,FALSE,TRUE,FALSE,TRUE
out,FALSE,FALSE,FALSE,FALSE,INV: and then .,FALSE,TRUE,FALSE,TRUE
out,FALSE,FALSE,FALSE,FALSE,CHI: the man who's kneeling down .,FALSE,TRUE,FALSE,TRUE
out,FALSE,FALSE,FALSE,FALSE,INV: what's he doing ?,FALSE,TRUE,FALSE,TRUE
out,FALSE,FALSE,FALSE,FALSE,CHI: <trying &~t> [//] he's picking the milk up .,FALSE,TRUE,FALSE,TRUE
out,FALSE,FALSE,FALSE,FALSE,INV: here's the lady who's sweeping the floor .,FALSE,TRUE,FALSE,TRUE
out,FALSE,FALSE,FALSE,FALSE,INV: this is the lady with the green coat on .,FALSE,TRUE,FALSE,TRUE
out,FALSE,FALSE,FALSE,FALSE,INV: this lady's holding a baby .,FALSE,TRUE,FALSE,TRUE
out,FALSE,FALSE,FALSE,FALSE,CHI: the lady who's brushing the floor .,FALSE,TRUE,FALSE,TRUE
out,FALSE,FALSE,FALSE,FALSE,INV: where are we gonna have her ?,FALSE,TRUE,FALSE,TRUE
out,FALSE,FALSE,FALSE,FALSE,"CHI: &-um , put her there .",FALSE,TRUE,FALSE,TRUE
out,FALSE,FALSE,FALSE,FALSE,INV: what do you think she's brushing ?,FALSE,TRUE,FALSE,TRUE
out,FALSE,FALSE,FALSE,FALSE,CHI: she brushing the floor to get all the dirt away from the doorstep .,FALSE,TRUE,FALSE,TRUE
out,FALSE,FALSE,FALSE,FALSE,INV: who next ?,FALSE,TRUE,FALSE,TRUE
out,FALSE,FALSE,FALSE,FALSE,"CHI: &-um , the [?] lady holding the baby .",FALSE,TRUE,FALSE,TRUE
out,FALSE,FALSE,FALSE,FALSE,INV: maybe she's going for a walk .,FALSE,TRUE,FALSE,TRUE
out,FALSE,FALSE,FALSE,FALSE,CHI: she going for a walk with the baby .,FALSE,TRUE,FALSE,TRUE
out,FALSE,FALSE,FALSE,FALSE,INV: last one .,FALSE,TRUE,FALSE,TRUE
out,FALSE,FALSE,FALSE,FALSE,CHI: the lady in the green dress .,FALSE,TRUE,FALSE,TRUE
out,FALSE,FALSE,FALSE,FALSE,CHI: she's going to the shop .,FALSE,TRUE,FALSE,TRUE
out,FALSE,FALSE,FALSE,FALSE,INV: here's the pussy cat who's lying down .,FALSE,TRUE,FALSE,TRUE
out,FALSE,FALSE,FALSE,FALSE,INV: here's the one who's standing up .,FALSE,TRUE,FALSE,TRUE
out,FALSE,FALSE,FALSE,FALSE,CHI: pussy cat who's lying down .,FALSE,TRUE,FALSE,TRUE
out,FALSE,FALSE,FALSE,FALSE,INV: is he gonna go to sleep ?,FALSE,TRUE,FALSE,TRUE
out,FALSE,FALSE,FALSE,FALSE,CHI: he's looking at the man .,FALSE,TRUE,FALSE,TRUE
out,FALSE,FALSE,FALSE,FALSE,INV: what's next ?,FALSE,TRUE,FALSE,TRUE
out,FALSE,FALSE,FALSE,FALSE,CHI: the cat who's walking .,FALSE,TRUE,FALSE,TRUE
out,FALSE,FALSE,FALSE,FALSE,INV: here's a little girl with a Cindy doll .,FALSE,TRUE,FALSE,TRUE
out,FALSE,FALSE,FALSE,FALSE,INV: this is the girl who's running .,FALSE,TRUE,FALSE,TRUE
out,FALSE,FALSE,FALSE,FALSE,INV: this one's playing with a baby in a pram .,FALSE,TRUE,FALSE,TRUE
out,FALSE,FALSE,FALSE,FALSE,INV: or is it a dolly ?,FALSE,TRUE,FALSE,TRUE
out,FALSE,FALSE,FALSE,FALSE,CHI: dolly .,FALSE,TRUE,FALSE,TRUE
out,FALSE,FALSE,FALSE,FALSE,INV: okay .,FALSE,TRUE,FALSE,TRUE
out,FALSE,FALSE,FALSE,FALSE,CHI: the one who's playing with the dolly in the pram .,FALSE,TRUE,FALSE,TRUE
out,FALSE,FALSE,FALSE,FALSE,INV: it's getting full up out here .,FALSE,TRUE,FALSE,TRUE
out,FALSE,FALSE,FALSE,FALSE,CHI: I'll put it over there by her mummie .,FALSE,TRUE,FALSE,TRUE
out,FALSE,FALSE,FALSE,FALSE,INV: next one .,FALSE,TRUE,FALSE,TRUE
out,FALSE,FALSE,FALSE,FALSE,CHI: the little girls who running .,FALSE,TRUE,FALSE,TRUE
out,FALSE,FALSE,FALSE,FALSE,INV: where's she going ?,FALSE,TRUE,FALSE,TRUE
out,FALSE,FALSE,FALSE,FALSE,CHI: to the postman to get the letter .,FALSE,TRUE,FALSE,TRUE
out,FALSE,FALSE,FALSE,FALSE,INV: can you remember ?,FALSE,TRUE,FALSE,TRUE
out,FALSE,FALSE,FALSE,FALSE,CHI: girl who's playing .,FALSE,TRUE,FALSE,TRUE
out,FALSE,FALSE,FALSE,FALSE,INV: what's she playing with ?,FALSE,TRUE,FALSE,TRUE
out,FALSE,FALSE,FALSE,FALSE,CHI: little cart .,FALSE,TRUE,FALSE,TRUE
out,FALSE,FALSE,FALSE,FALSE,CHI: Cindy doll .,FALSE,TRUE,FALSE,TRUE
out,FALSE,FALSE,FALSE,FALSE,"CHI: &-um , go by her mummie .",FALSE,TRUE,FALSE,TRUE
out,FALSE,FALSE,FALSE,FALSE,INV: that's her mummie .,FALSE,TRUE,FALSE,TRUE
out,FALSE,FALSE,FALSE,FALSE,"CHI: yeah , and that's her mummie .",FALSE,TRUE,FALSE,TRUE
out,FALSE,FALSE,FALSE,FALSE,INV: do you think that's a little boy or a little girl ?,FALSE,TRUE,FALSE,TRUE
out,FALSE,FALSE,FALSE,FALSE,CHI: it's a little girl .,FALSE,TRUE,FALSE,TRUE
out,FALSE,FALSE,FALSE,FALSE,CHI: that's a [=? her] little sister .,FALSE,TRUE,FALSE,TRUE
out,FALSE,FALSE,FALSE,FALSE,INV: here's a ball with red spots on .,FALSE,TRUE,FALSE,TRUE
out,FALSE,FALSE,FALSE,FALSE,INV: this is the ball that the boy is kicking .,FALSE,TRUE,FALSE,TRUE
out,FALSE,FALSE,FALSE,FALSE,INV: these are the two balls that the little girl is holding .,FALSE,TRUE,FALSE,TRUE
out,FALSE,FALSE,FALSE,FALSE,CHI: the little girl who's holding the two little balls .,FALSE,TRUE,FALSE,TRUE
out,FALSE,FALSE,FALSE,FALSE,INV: what is she doing ?,FALSE,TRUE,FALSE,TRUE
out,FALSE,FALSE,FALSE,FALSE,CHI: juggling .,FALSE,TRUE,FALSE,TRUE
out,FALSE,FALSE,FALSE,FALSE,INV: can you juggle ?,FALSE,TRUE,FALSE,TRUE
out,FALSE,FALSE,FALSE,FALSE,CHI: &=shakes:head .,FALSE,TRUE,FALSE,TRUE
out,FALSE,FALSE,FALSE,FALSE,INV: who next ?,FALSE,TRUE,FALSE,TRUE
out,FALSE,FALSE,FALSE,FALSE,CHI: the ball .,FALSE,TRUE,FALSE,TRUE
out,FALSE,FALSE,FALSE,FALSE,INV: that's what she's doing .,FALSE,TRUE,FALSE,TRUE
out,FALSE,FALSE,FALSE,FALSE,CHI: there .,FALSE,TRUE,FALSE,TRUE
out,FALSE,FALSE,FALSE,FALSE,CHI: kicking the ball .,FALSE,TRUE,FALSE,TRUE
out,FALSE,FALSE,FALSE,FALSE,INV: and .,FALSE,TRUE,FALSE,TRUE
out,FALSE,FALSE,FALSE,FALSE,CHI: the boy who's kicking the ball .,FALSE,TRUE,FALSE,TRUE
out,FALSE,FALSE,FALSE,FALSE,INV: here's the blue car .,FALSE,TRUE,FALSE,TRUE
out,FALSE,FALSE,FALSE,FALSE,INV: it's a go-cart .,FALSE,TRUE,FALSE,TRUE
out,FALSE,FALSE,FALSE,FALSE,INV: that's the car that the boy is pulling .,FALSE,TRUE,FALSE,TRUE
out,FALSE,FALSE,FALSE,FALSE,CHI: go-cart .,FALSE,TRUE,FALSE,TRUE
out,FALSE,FALSE,FALSE,FALSE,INV: who does that belong to ?,FALSE,TRUE,FALSE,TRUE
out,FALSE,FALSE,FALSE,FALSE,"CHI: the little boy , but he's playing with his ball .",FALSE,TRUE,FALSE,TRUE
out,FALSE,FALSE,FALSE,FALSE,INV: what next ?,FALSE,TRUE,FALSE,TRUE
out,FALSE,FALSE,FALSE,FALSE,"CHI: &-um , (.) the little boy who's pulling the car along .",FALSE,TRUE,FALSE,TRUE
out,FALSE,FALSE,FALSE,FALSE,INV: one more .,FALSE,TRUE,FALSE,TRUE
out,FALSE,FALSE,FALSE,FALSE,CHI: a normal car .,FALSE,TRUE,FALSE,TRUE
out,FALSE,FALSE,FALSE,FALSE,INV: nearly normal .,FALSE,TRUE,FALSE,TRUE
out,FALSE,FALSE,FALSE,FALSE,CHI: and that could go +...,FALSE,TRUE,FALSE,TRUE
out,FALSE,FALSE,FALSE,FALSE,INV: that's the little other boy's car .,FALSE,TRUE,FALSE,TRUE
out,FALSE,FALSE,FALSE,FALSE,INV: here's a dog who's sleeping .,FALSE,TRUE,FALSE,TRUE
out,FALSE,FALSE,FALSE,FALSE,INV: this is the one who's jumping up .,FALSE,TRUE,FALSE,TRUE
out,FALSE,FALSE,FALSE,FALSE,CHI: dog who's jumping up .,FALSE,TRUE,FALSE,TRUE
out,FALSE,FALSE,FALSE,FALSE,INV: who's he gonna jump up at ?,FALSE,TRUE,FALSE,TRUE
out,FALSE,FALSE,FALSE,FALSE,CHI: at the lady .,FALSE,TRUE,FALSE,TRUE
out,FALSE,FALSE,FALSE,FALSE,CHI: he wants something xxx .,FALSE,TRUE,FALSE,TRUE
out,FALSE,FALSE,FALSE,FALSE,INV: what's the other one doing ?,FALSE,TRUE,FALSE,TRUE
out,FALSE,FALSE,FALSE,FALSE,CHI: the dog who [=? who's] sleeping .,FALSE,TRUE,FALSE,TRUE
out,FALSE,FALSE,FALSE,FALSE,INV: where's he gonna be sleeping ?,FALSE,TRUE,FALSE,TRUE
out,FALSE,FALSE,FALSE,FALSE,CHI: in front of the car .,FALSE,TRUE,FALSE,TRUE
out,FALSE,FALSE,FALSE,FALSE,INV: dogs don't like cats „ do they .,FALSE,TRUE,FALSE,TRUE
out,FALSE,FALSE,FALSE,FALSE,"CHI: no , that dog hates that cat .",FALSE,TRUE,FALSE,TRUE
out,FALSE,FALSE,FALSE,FALSE,INV: which dog hates which cat .,FALSE,TRUE,FALSE,TRUE
out,FALSE,FALSE,FALSE,FALSE,CHI: that dog hates that cat .,FALSE,TRUE,FALSE,TRUE
out,FALSE,FALSE,FALSE,FALSE,CHI: and that dog hates that cat .,FALSE,TRUE,FALSE,TRUE
in,TRUE,FALSE,FALSE,TRUE,CHI: in that picture a little boy's walking along the road .,TRUE,TRUE,TRUE,TRUE
in,FALSE,TRUE,FALSE,FALSE,CHI: in this picture the little boy wants a green balloon .,TRUE,TRUE,TRUE,TRUE
in,FALSE,FALSE,FALSE,FALSE,CHI: in this picture the man gives the little boy a green balloon .,TRUE,TRUE,TRUE,TRUE
in,FALSE,FALSE,FALSE,FALSE,CHI: this picture the little boy's taking the green balloon home .,TRUE,TRUE,TRUE,TRUE
in,FALSE,FALSE,FALSE,FALSE,CHI: in this picture the little boy lets go of the balloon .,TRUE,TRUE,TRUE,TRUE
in,FALSE,FALSE,FALSE,FALSE,CHI: and it flies away .,TRUE,TRUE,TRUE,TRUE
in,FALSE,FALSE,FALSE,FALSE,CHI: this picture the little boy starts to cry .,TRUE,TRUE,TRUE,TRUE
out,FALSE,FALSE,FALSE,FALSE,INV: why ?,TRUE,TRUE,TRUE,TRUE
in,FALSE,FALSE,TRUE,FALSE,CHI: (be)cause he's lost his balloon .,TRUE,TRUE,TRUE,TRUE
out,FALSE,FALSE,FALSE,FALSE,INV: what kind of games do you play at platytime [: playtime] ?,FALSE,TRUE,FALSE,TRUE
in,TRUE,FALSE,FALSE,TRUE,"CHI: &-um , sometimes we play hopscotch .",TRUE,TRUE,TRUE,TRUE
in,FALSE,TRUE,FALSE,FALSE,CHI: sometimes we play house <and pretend to> [?] play blinds man buff .,TRUE,TRUE,TRUE,TRUE
out,FALSE,FALSE,FALSE,FALSE,INV: do you ?,TRUE,TRUE,TRUE,TRUE
in,FALSE,FALSE,FALSE,FALSE,CHI: and sometimes we play tick .,TRUE,TRUE,TRUE,TRUE
in,FALSE,FALSE,FALSE,FALSE,CHI: and sometimes we play school .,TRUE,TRUE,TRUE,TRUE
in,FALSE,FALSE,FALSE,FALSE,CHI: sometimes we play witches .,TRUE,TRUE,TRUE,TRUE
out,FALSE,FALSE,FALSE,FALSE,INV: what's that ?,TRUE,TRUE,TRUE,TRUE
in,FALSE,FALSE,FALSE,FALSE,CHI: <there's> [//] you gotta pick a little girl .,TRUE,TRUE,TRUE,TRUE
in,FALSE,FALSE,FALSE,FALSE,CHI: and it's gotta be a witch and gotta chase after you .,TRUE,TRUE,TRUE,TRUE
in,FALSE,FALSE,TRUE,FALSE,CHI: and when they get you it's your turn to be the witch .,TRUE,TRUE,TRUE,TRUE
out,FALSE,FALSE,FALSE,FALSE,INV: oh dear .,FALSE,TRUE,FALSE,TRUE
out,FALSE,FALSE,FALSE,FALSE,INV: what's tick ?,FALSE,TRUE,FALSE,TRUE
in,TRUE,FALSE,FALSE,FALSE,"CHI: well , you start +...",TRUE,TRUE,TRUE,TRUE
in,FALSE,FALSE,FALSE,FALSE,INV: first of all you start on one .,TRUE,TRUE,TRUE,TRUE
in,FALSE,FALSE,FALSE,FALSE,CHI: and then you [=? you've] gotta tap somebody .,TRUE,TRUE,TRUE,TRUE
in,FALSE,FALSE,FALSE,FALSE,CHI: and then they've gotta be a man .,TRUE,TRUE,TRUE,TRUE
in,FALSE,FALSE,TRUE,FALSE,CHI: and then they've gotta run after you and try and tick you .,TRUE,TRUE,TRUE,TRUE
out,FALSE,FALSE,FALSE,FALSE,INV: these children have lots_of pets .,FALSE,TRUE,FALSE,TRUE
out,FALSE,FALSE,FALSE,FALSE,CHI: xxx .,FALSE,TRUE,FALSE,TRUE
in,TRUE,FALSE,FALSE,TRUE,INV: every day when John gets sleepy +...,TRUE,TRUE,TRUE,TRUE
out,FALSE,FALSE,FALSE,FALSE,CHI: 0 .,TRUE,FALSE,FALSE,TRUE
out,FALSE,FALSE,FALSE,FALSE,INV: what does he do ?,TRUE,FALSE,FALSE,TRUE
in,FALSE,TRUE,TRUE,FALSE,CHI: go to sleep .,TRUE,TRUE,TRUE,TRUE
in,TRUE,FALSE,FALSE,TRUE,INV: every day when Mary gets hungry +...,TRUE,TRUE,TRUE,TRUE
in,FALSE,TRUE,FALSE,FALSE,CHI: ++ she get [=? gets] something to eat .,TRUE,TRUE,TRUE,TRUE
out,FALSE,FALSE,FALSE,FALSE,INV: what's she eating ?,TRUE,TRUE,TRUE,TRUE
in,FALSE,FALSE,FALSE,FALSE,CHI: potatoes .,TRUE,TRUE,TRUE,TRUE
in,FALSE,FALSE,FALSE,TRUE,INV: cakes .,TRUE,TRUE,TRUE,TRUE
in,FALSE,TRUE,TRUE,FALSE,CHI: cakes and sandwiches and beefburgers and butties .,TRUE,TRUE,TRUE,TRUE
out,FALSE,FALSE,FALSE,FALSE,INV: what's your favorite food ?,FALSE,TRUE,FALSE,TRUE
out,FALSE,FALSE,FALSE,FALSE,CHI: biscuits .,FALSE,TRUE,FALSE,TRUE
out,FALSE,FALSE,FALSE,FALSE,INV: what do you have for breakfast ?,FALSE,TRUE,FALSE,TRUE
out,FALSE,FALSE,FALSE,FALSE,CHI: cornflakes .,FALSE,TRUE,FALSE,TRUE
in,TRUE,FALSE,FALSE,TRUE,INV: Jill found a bird's nest outside in a tree .,TRUE,TRUE,TRUE,TRUE
in,FALSE,TRUE,FALSE,FALSE,INV: she showed it +...,TRUE,TRUE,TRUE,TRUE
in,FALSE,FALSE,TRUE,TRUE,CHI: ++ to her friends .,TRUE,TRUE,TRUE,TRUE
in,TRUE,TRUE,FALSE,FALSE,INV: yesterday was Peter's birthday .,TRUE,TRUE,TRUE,TRUE
in,FALSE,FALSE,FALSE,TRUE,INV: dad gave +...,TRUE,TRUE,TRUE,TRUE
in,FALSE,TRUE,TRUE,FALSE,CHI: ++ him a balloon .,TRUE,TRUE,TRUE,TRUE
in,TRUE,FALSE,FALSE,TRUE,"INV: yesterday when William came home , he saw that his brother +...",TRUE,TRUE,TRUE,TRUE
in,FALSE,TRUE,TRUE,FALSE,CHI: ++ was watching television .,TRUE,TRUE,TRUE,TRUE
in,TRUE,FALSE,FALSE,TRUE,INV: Sally and Jane climbed up into this tree .,TRUE,TRUE,TRUE,TRUE
in,FALSE,TRUE,FALSE,FALSE,INV: if they fall out_of the tree now +...,TRUE,TRUE,TRUE,TRUE
out,FALSE,FALSE,FALSE,FALSE,CHI: 0 .,TRUE,TRUE,TRUE,TRUE
out,FALSE,FALSE,FALSE,FALSE,INV: what will happen ?,TRUE,TRUE,TRUE,TRUE
in,FALSE,FALSE,TRUE,TRUE,CHI: they would hurt theirselves [: themselves] [*] .,TRUE,TRUE,TRUE,TRUE
in,TRUE,TRUE,FALSE,FALSE,INV: James wanted to get some biscuits from the table .,TRUE,TRUE,TRUE,TRUE
in,FALSE,FALSE,FALSE,FALSE,INV: so he stood on tiptoes and he stretched and stretched +...,TRUE,TRUE,TRUE,TRUE
in,FALSE,FALSE,TRUE,FALSE,CHI: ++ but he can't reach them .,TRUE,TRUE,TRUE,TRUE
in,TRUE,FALSE,FALSE,TRUE,INV: it was very late and Peter was tired .,TRUE,TRUE,TRUE,TRUE
in,FALSE,TRUE,FALSE,FALSE,INV: his mummie said you@q +...,TRUE,TRUE,TRUE,TRUE
in,FALSE,FALSE,TRUE,FALSE,CHI: ++ go to bed .,TRUE,TRUE,TRUE,TRUE
out,FALSE,FALSE,FALSE,FALSE,INV: Eddie didn't know how to tie his shoes so he if [?] his mother +...,FALSE,TRUE,FALSE,TRUE
out,FALSE,FALSE,FALSE,FALSE,CHI: ++ would help him .,FALSE,TRUE,FALSE,TRUE
