in/out/ambiguous,start_human,start_llm,end_human,end_llm,Transcript,story_seg_human,story_seg_llm,intersection,union
out,FALSE,FALSE,FALSE,FALSE,INV: have you been to a farm before ?,FALSE,FALSE,FALSE,FALSE
out,FALSE,FALSE,FALSE,FALSE,CHI: yeah .,FALSE,FALSE,FALSE,FALSE
in,TRUE,TRUE,FALSE,FALSE,CHI: there's one round by ours [=? our house] .,TRUE,TRUE,TRUE,TRUE
out,FALSE,FALSE,FALSE,FALSE,INV: is there ?,TRUE,TRUE,TRUE,TRUE
out,FALSE,FALSE,FALSE,FALSE,CHI: yeah .,TRUE,TRUE,TRUE,TRUE
out,FALSE,FALSE,FALSE,FALSE,INV: what's on it ?,TRUE,TRUE,TRUE,TRUE
out,FALSE,FALSE,FALSE,FALSE,INV: lots_of animals ?,TRUE,TRUE,TRUE,TRUE
in,FALSE,FALSE,FALSE,TRUE,CHI: like there's only horses .,TRUE,TRUE,TRUE,TRUE
in,FALSE,TRUE,FALSE,FALSE,CHI: there useta be pigs and all that .,TRUE,TRUE,TRUE,TRUE
in,FALSE,FALSE,FALSE,FALSE,CHI: <but they've> [//] but they [=? they're] gone .,TRUE,TRUE,TRUE,TRUE
out,FALSE,FALSE,FALSE,FALSE,INV: where have they gone ?,TRUE,TRUE,TRUE,TRUE
out,FALSE,FALSE,FALSE,FALSE,CHI: I don't know .,TRUE,TRUE,TRUE,TRUE
in,FALSE,FALSE,TRUE,FALSE,CHI: they [=? they've] probably gone to another farm .,TRUE,TRUE,TRUE,TRUE
out,FALSE,FALSE,FALSE,FALSE,INV: have you ever ridden a horse on that farm ?,FALSE,TRUE,FALSE,TRUE
out,FALSE,FALSE,FALSE,FALSE,CHI: no .,FALSE,TRUE,FALSE,TRUE
out,FALSE,FALSE,FALSE,FALSE,INV: I'd love to ride a horse „ wouldn't you ?,FALSE,TRUE,FALSE,TRUE
out,FALSE,FALSE,FALSE,FALSE,CHI: yeah .,FALSE,TRUE,FALSE,TRUE
out,FALSE,FALSE,FALSE,FALSE,INV: do you think this is a house or a barn ?,FALSE,TRUE,FALSE,TRUE
out,FALSE,FALSE,FALSE,FALSE,CHI: a house .,FALSE,TRUE,FALSE,TRUE
out,FALSE,FALSE,FALSE,FALSE,INV: what are you missing while we're playing these games ?,FALSE,TRUE,FALSE,TRUE
in,TRUE,FALSE,FALSE,TRUE,CHI: (be)cause like we're having a play call [=? called] Pinochio and Jepeso so we gotta get all the stuff set up .,TRUE,TRUE,TRUE,TRUE
out,FALSE,FALSE,FALSE,FALSE,INV: I see .,TRUE,FALSE,FALSE,TRUE
in,FALSE,TRUE,FALSE,FALSE,CHI: (be)cause [/] (be)cause we're having it for Easter .,TRUE,TRUE,TRUE,TRUE
out,FALSE,FALSE,FALSE,FALSE,INV: are you in the play ?,TRUE,TRUE,TRUE,TRUE
in,FALSE,FALSE,FALSE,TRUE,"CHI: yeah , I'm Jepeso .",TRUE,TRUE,TRUE,TRUE
out,FALSE,FALSE,FALSE,FALSE,INV: are you ?,TRUE,FALSE,FALSE,TRUE
out,FALSE,FALSE,FALSE,FALSE,CHI: yeah .,TRUE,FALSE,FALSE,TRUE
out,FALSE,FALSE,FALSE,FALSE,INV: have you learned all your lines ?,TRUE,FALSE,FALSE,TRUE
out,FALSE,FALSE,FALSE,FALSE,CHI: yeah .,TRUE,FALSE,FALSE,TRUE
out,FALSE,FALSE,FALSE,FALSE,INV: isn't it a bit scary being in a play ?,TRUE,FALSE,FALSE,TRUE
out,FALSE,FALSE,FALSE,FALSE,CHI: no .,TRUE,FALSE,FALSE,TRUE
out,FALSE,FALSE,FALSE,FALSE,INV: what's it about .,TRUE,FALSE,FALSE,TRUE
in,FALSE,TRUE,FALSE,FALSE,CHI: it's like I [=? I'm] a puppet .,TRUE,TRUE,TRUE,TRUE
in,FALSE,FALSE,FALSE,FALSE,CHI: and it runs away from me .,TRUE,TRUE,TRUE,TRUE
in,FALSE,FALSE,FALSE,FALSE,CHI: and like I'm searching for it in the sea .,TRUE,TRUE,TRUE,TRUE
in,FALSE,FALSE,FALSE,TRUE,CHI: and then (.) <the big> [//] a big shark comes .,TRUE,TRUE,TRUE,TRUE
in,FALSE,TRUE,FALSE,FALSE,CHI: and then it gets me w [//] and with Pinochio .,TRUE,TRUE,TRUE,TRUE
out,FALSE,FALSE,FALSE,FALSE,INV: does it eat the puppy ?,TRUE,TRUE,TRUE,TRUE
in,FALSE,FALSE,FALSE,FALSE,CHI: puppet .,TRUE,TRUE,TRUE,TRUE
out,FALSE,FALSE,FALSE,FALSE,INV: does it eat it ?,TRUE,TRUE,TRUE,TRUE
in,FALSE,FALSE,FALSE,FALSE,"CHI: no , <we d> [//] it's like +/.",TRUE,TRUE,TRUE,TRUE
out,FALSE,FALSE,FALSE,FALSE,INV: what does the shark do ?,TRUE,TRUE,TRUE,TRUE
in,FALSE,FALSE,FALSE,TRUE,CHI: nobody's a shark .,TRUE,TRUE,TRUE,TRUE
in,FALSE,TRUE,FALSE,FALSE,CHI: it's just like a big hula hoop .,TRUE,TRUE,TRUE,TRUE
in,FALSE,FALSE,TRUE,FALSE,"CHI: I think it's gonna be all other hula hoops , like you know „ making a tunnel so we gotta crawl through there .",TRUE,TRUE,TRUE,TRUE
out,FALSE,FALSE,FALSE,FALSE,INV: so who's gonna come and see this play ?,FALSE,TRUE,FALSE,TRUE
out,FALSE,FALSE,FALSE,FALSE,CHI: <my mum> [//] all our mums and dads .,FALSE,TRUE,FALSE,TRUE
out,FALSE,FALSE,FALSE,FALSE,INV: have you finished practising for it ?,FALSE,TRUE,FALSE,TRUE
out,FALSE,FALSE,FALSE,FALSE,CHI: no .,FALSE,TRUE,FALSE,TRUE
out,FALSE,FALSE,FALSE,FALSE,INV: have you ever done a play before ?,FALSE,TRUE,FALSE,TRUE
out,FALSE,FALSE,FALSE,FALSE,CHI: yes .,FALSE,TRUE,FALSE,TRUE
in,TRUE,FALSE,FALSE,TRUE,CHI: we're doing like Three Kings .,TRUE,TRUE,TRUE,TRUE
in,FALSE,TRUE,FALSE,FALSE,CHI: but <when I> [//] when we [=? we're] doing it our school got broken into so we couldn't do it .,TRUE,TRUE,TRUE,TRUE
out,FALSE,FALSE,FALSE,FALSE,INV: what got broken ?,TRUE,TRUE,TRUE,TRUE
in,FALSE,FALSE,FALSE,FALSE,"CHI: well , you know where <we we> [//] we're in , the hall .",TRUE,TRUE,TRUE,TRUE
out,FALSE,FALSE,FALSE,FALSE,INV: yeah .,TRUE,TRUE,TRUE,TRUE
in,FALSE,FALSE,FALSE,FALSE,CHI: they made a big hole through .,TRUE,TRUE,TRUE,TRUE
in,FALSE,FALSE,FALSE,TRUE,CHI: and then they got off .,TRUE,TRUE,TRUE,TRUE
in,FALSE,TRUE,FALSE,FALSE,CHI: then they threw all fire in it .,TRUE,TRUE,TRUE,TRUE
out,FALSE,FALSE,FALSE,FALSE,INV: is that that hole in ceiling ?,TRUE,TRUE,TRUE,TRUE
out,FALSE,FALSE,FALSE,FALSE,CHI: yeah .,TRUE,TRUE,TRUE,TRUE
out,FALSE,FALSE,FALSE,FALSE,INV: what happened there ?,TRUE,TRUE,TRUE,TRUE
out,FALSE,FALSE,FALSE,FALSE,CHI: I don't know .,TRUE,TRUE,TRUE,TRUE
out,FALSE,FALSE,FALSE,FALSE,INV: was that during the holidays ?,TRUE,TRUE,TRUE,TRUE
in,FALSE,FALSE,TRUE,FALSE,"CHI: yeah , when we were off .",TRUE,TRUE,TRUE,TRUE
out,FALSE,FALSE,FALSE,FALSE,INV: have they been repainting the school ?,FALSE,TRUE,FALSE,TRUE
out,FALSE,FALSE,FALSE,FALSE,CHI: yeah .,FALSE,TRUE,FALSE,TRUE
out,FALSE,FALSE,FALSE,FALSE,INV: where are we gonna put the cart ?,FALSE,TRUE,FALSE,TRUE
out,FALSE,FALSE,FALSE,FALSE,CHI: it can go there .,FALSE,TRUE,FALSE,TRUE
out,FALSE,FALSE,FALSE,FALSE,INV: yeah .,FALSE,TRUE,FALSE,TRUE
out,FALSE,FALSE,FALSE,FALSE,INV: what's your favorite lesson ?,FALSE,TRUE,FALSE,TRUE
out,FALSE,FALSE,FALSE,FALSE,CHI: I don't know .,FALSE,TRUE,FALSE,TRUE
out,FALSE,FALSE,FALSE,FALSE,INV: what are you good at ?,FALSE,TRUE,FALSE,TRUE
in,TRUE,FALSE,FALSE,TRUE,CHI: I'm good at football .,TRUE,TRUE,TRUE,TRUE
out,FALSE,FALSE,FALSE,FALSE,INV: that's not a lesson .,TRUE,FALSE,FALSE,TRUE
out,FALSE,FALSE,FALSE,FALSE,CHI: I'm good at sums .,TRUE,FALSE,FALSE,TRUE
out,FALSE,FALSE,FALSE,FALSE,INV: who teaches you sums ?,TRUE,FALSE,FALSE,TRUE
out,FALSE,FALSE,FALSE,FALSE,CHI: our teachers .,TRUE,FALSE,FALSE,TRUE
out,FALSE,FALSE,FALSE,FALSE,INV: you play football at playtime „ do you .,TRUE,FALSE,FALSE,TRUE
in,FALSE,TRUE,FALSE,FALSE,"CHI: no , when you're in the juniors' , we play football .",TRUE,TRUE,TRUE,TRUE
out,FALSE,FALSE,FALSE,FALSE,INV: have you got a football team ?,TRUE,TRUE,TRUE,TRUE
out,FALSE,FALSE,FALSE,FALSE,CHI: yeah .,TRUE,TRUE,TRUE,TRUE
out,FALSE,FALSE,FALSE,FALSE,INV: a school team or a proper team ?,TRUE,TRUE,TRUE,TRUE
in,FALSE,FALSE,FALSE,FALSE,CHI: a proper team .,TRUE,TRUE,TRUE,TRUE
out,FALSE,FALSE,FALSE,FALSE,INV: which one ?,TRUE,TRUE,TRUE,TRUE
in,FALSE,FALSE,FALSE,FALSE,CHI: Everton .,TRUE,TRUE,TRUE,TRUE
out,FALSE,FALSE,FALSE,FALSE,INV: didn't they have a game the other night ?,TRUE,TRUE,TRUE,TRUE
in,FALSE,FALSE,FALSE,FALSE,CHI: Everton won some [//] a team but it three nil .,TRUE,TRUE,TRUE,TRUE
in,FALSE,FALSE,TRUE,FALSE,INV: three nil .,TRUE,TRUE,TRUE,TRUE
out,FALSE,FALSE,FALSE,FALSE,CHI: yeah .,FALSE,TRUE,FALSE,TRUE
out,FALSE,FALSE,FALSE,FALSE,INV: what are you thinking ?,FALSE,TRUE,FALSE,TRUE
out,FALSE,FALSE,FALSE,FALSE,CHI: I'm wondering where this &~c [//] will go .,FALSE,TRUE,FALSE,TRUE
out,FALSE,FALSE,FALSE,FALSE,"INV: yeah , like that .",FALSE,TRUE,FALSE,TRUE
out,FALSE,FALSE,FALSE,FALSE,CHI: can put the bucket underneath there .,FALSE,TRUE,FALSE,TRUE
out,FALSE,FALSE,FALSE,FALSE,INV: like that .,FALSE,TRUE,FALSE,TRUE
out,FALSE,FALSE,FALSE,FALSE,INV: did you have a christmas tree like that at christmas ?,FALSE,TRUE,FALSE,TRUE
out,FALSE,FALSE,FALSE,FALSE,CHI: yeah .,FALSE,TRUE,FALSE,TRUE
out,FALSE,FALSE,FALSE,FALSE,INV: what did you get for christmas ?,FALSE,TRUE,FALSE,TRUE
in,TRUE,FALSE,FALSE,TRUE,CHI: a computer .,TRUE,TRUE,TRUE,TRUE
out,FALSE,FALSE,FALSE,FALSE,INV: brilliant .,TRUE,FALSE,FALSE,TRUE
out,FALSE,FALSE,FALSE,FALSE,INV: what kind ?,TRUE,FALSE,FALSE,TRUE
in,FALSE,TRUE,FALSE,FALSE,CHI: a Sinclair Spectrum .,TRUE,TRUE,TRUE,TRUE
out,FALSE,FALSE,FALSE,FALSE,INV: do you know how to use it ?,TRUE,TRUE,TRUE,TRUE
out,FALSE,FALSE,FALSE,FALSE,CHI: yeah .,TRUE,TRUE,TRUE,TRUE
out,FALSE,FALSE,FALSE,FALSE,INV: what games do you play on it ?,TRUE,TRUE,TRUE,TRUE
in,FALSE,FALSE,FALSE,TRUE,"CHI: I play Daley Thomson , Decathlon , Worms .",TRUE,TRUE,TRUE,TRUE
in,FALSE,TRUE,TRUE,FALSE,CHI: I've got millions of games .,TRUE,TRUE,TRUE,TRUE
out,FALSE,FALSE,FALSE,FALSE,CHI: but I can't think of them .,FALSE,TRUE,FALSE,TRUE
out,FALSE,FALSE,FALSE,FALSE,INV: have you got any brothers and sisters ?,FALSE,TRUE,FALSE,TRUE
out,FALSE,FALSE,FALSE,FALSE,CHI: I've got a sister .,FALSE,TRUE,FALSE,TRUE
out,FALSE,FALSE,FALSE,FALSE,INV: does she play with it ?,FALSE,TRUE,FALSE,TRUE
out,FALSE,FALSE,FALSE,FALSE,CHI: yeah .,FALSE,TRUE,FALSE,TRUE
out,FALSE,FALSE,FALSE,FALSE,INV: is she younger than you ?,FALSE,TRUE,FALSE,TRUE
out,FALSE,FALSE,FALSE,FALSE,CHI: older .,FALSE,TRUE,FALSE,TRUE
out,FALSE,FALSE,FALSE,FALSE,INV: who bought it for you then ?,FALSE,TRUE,FALSE,TRUE
out,FALSE,FALSE,FALSE,FALSE,CHI: I don't +...,FALSE,TRUE,FALSE,TRUE
out,FALSE,FALSE,FALSE,FALSE,INV: did it come with Father Christmas ?,FALSE,TRUE,FALSE,TRUE
out,FALSE,FALSE,FALSE,FALSE,CHI: yeah .,FALSE,TRUE,FALSE,TRUE
out,FALSE,FALSE,FALSE,FALSE,"INV: what_about that tractor , or isn't there room for it ?",FALSE,TRUE,FALSE,TRUE
out,FALSE,FALSE,FALSE,FALSE,"CHI: yeah , there's room .",FALSE,TRUE,FALSE,TRUE
out,FALSE,FALSE,FALSE,FALSE,CHI: but <I don> [/] I don't know [?] where it can go .,FALSE,TRUE,FALSE,TRUE
out,FALSE,FALSE,FALSE,FALSE,INV: over here .,FALSE,TRUE,FALSE,TRUE
out,FALSE,FALSE,FALSE,FALSE,INV: he's gotta be on the horse or on the tractor .,FALSE,TRUE,FALSE,TRUE
out,FALSE,FALSE,FALSE,FALSE,"INV: which one , do you reckon ?",FALSE,TRUE,FALSE,TRUE
out,FALSE,FALSE,FALSE,FALSE,"CHI: well , the tractor can be outside the doorway so +...",FALSE,TRUE,FALSE,TRUE
out,FALSE,FALSE,FALSE,FALSE,INV: waiting for somebody .,FALSE,TRUE,FALSE,TRUE
out,FALSE,FALSE,FALSE,FALSE,CHI: yeah .,FALSE,TRUE,FALSE,TRUE
out,FALSE,FALSE,FALSE,FALSE,INV: or have you got a better idea .,FALSE,TRUE,FALSE,TRUE
out,FALSE,FALSE,FALSE,FALSE,CHI: <I can't> [/] I can't think of an idea .,FALSE,TRUE,FALSE,TRUE
out,FALSE,FALSE,FALSE,FALSE,"INV: do they eat grass , pigs ?",FALSE,TRUE,FALSE,TRUE
out,FALSE,FALSE,FALSE,FALSE,CHI: pardon .,FALSE,TRUE,FALSE,TRUE
out,FALSE,FALSE,FALSE,FALSE,INV: do pigs eat grass ?,FALSE,TRUE,FALSE,TRUE
out,FALSE,FALSE,FALSE,FALSE,CHI: no .,FALSE,TRUE,FALSE,TRUE
out,FALSE,FALSE,FALSE,FALSE,INV: who do think can hold that &=saw ?,FALSE,TRUE,FALSE,TRUE
out,FALSE,FALSE,FALSE,FALSE,CHI: (be)cause <he's> [//] he looks like he [=? he's] sawing it „ doesn't he .,FALSE,TRUE,FALSE,TRUE
out,FALSE,FALSE,FALSE,FALSE,INV: it's pointing the wrong way .,FALSE,TRUE,FALSE,TRUE
out,FALSE,FALSE,FALSE,FALSE,CHI: uhhuh .,FALSE,TRUE,FALSE,TRUE
out,FALSE,FALSE,FALSE,FALSE,INV: do you only play games on your computer then ?,FALSE,TRUE,FALSE,TRUE
in,TRUE,FALSE,FALSE,TRUE,"CHI: no , you can do sums and like pi [//] draw pictures .",TRUE,TRUE,TRUE,TRUE
out,FALSE,FALSE,FALSE,FALSE,INV: how do you do that ?,TRUE,FALSE,FALSE,TRUE
in,FALSE,TRUE,FALSE,FALSE,"CHI: like it's , you know where it goes k@l or l@l , you gotta press symbol shift and xxx .",TRUE,TRUE,TRUE,TRUE
in,FALSE,FALSE,FALSE,FALSE,CHI: then it goes go@o .,TRUE,TRUE,TRUE,TRUE
in,FALSE,FALSE,FALSE,TRUE,CHI: then you can draw a castle .,TRUE,TRUE,TRUE,TRUE
out,FALSE,FALSE,FALSE,FALSE,INV: can you draw anything you want ?,TRUE,FALSE,FALSE,TRUE
in,FALSE,TRUE,FALSE,FALSE,"CHI: well , <it mi> [//] you might be able to draw a clown .",TRUE,TRUE,TRUE,TRUE
out,FALSE,FALSE,FALSE,FALSE,INV: how long (doe)s it take to learn how to do that ?,TRUE,TRUE,TRUE,TRUE
out,FALSE,FALSE,FALSE,FALSE,CHI: I don't know .,TRUE,TRUE,TRUE,TRUE
out,FALSE,FALSE,FALSE,FALSE,INV: you must know .,TRUE,TRUE,TRUE,TRUE
in,FALSE,FALSE,FALSE,TRUE,CHI: my ma [/] mate had a computer .,TRUE,TRUE,TRUE,TRUE
in,FALSE,TRUE,TRUE,FALSE,CHI: and I played on it so I know how to play on the computer .,TRUE,TRUE,TRUE,TRUE
out,FALSE,FALSE,FALSE,FALSE,INV: I see .,FALSE,TRUE,FALSE,TRUE
out,FALSE,FALSE,FALSE,FALSE,@Situation: house game,FALSE,TRUE,FALSE,TRUE
out,FALSE,FALSE,FALSE,FALSE,INV: &=intro .,FALSE,TRUE,FALSE,TRUE
out,FALSE,FALSE,FALSE,FALSE,INV: there's a man who's kneeling down .,FALSE,TRUE,FALSE,TRUE
out,FALSE,FALSE,FALSE,FALSE,INV: that's a man with a brown suit on .,FALSE,TRUE,FALSE,TRUE
out,FALSE,FALSE,FALSE,FALSE,INV: that's the milkman .,FALSE,TRUE,FALSE,TRUE
out,FALSE,FALSE,FALSE,FALSE,INV: that's the postman .,FALSE,TRUE,FALSE,TRUE
out,FALSE,FALSE,FALSE,FALSE,CHI: postman .,FALSE,TRUE,FALSE,TRUE
out,FALSE,FALSE,FALSE,FALSE,INV: bung him on .,FALSE,TRUE,FALSE,TRUE
out,FALSE,FALSE,FALSE,FALSE,INV: is he going towards the house ?,FALSE,TRUE,FALSE,TRUE
out,FALSE,FALSE,FALSE,FALSE,CHI: to give the house some letters .,FALSE,TRUE,FALSE,TRUE
out,FALSE,FALSE,FALSE,FALSE,INV: what's next ?,FALSE,TRUE,FALSE,TRUE
out,FALSE,FALSE,FALSE,FALSE,CHI: milkman .,FALSE,TRUE,FALSE,TRUE
out,FALSE,FALSE,FALSE,FALSE,CHI: he's walking to a different house .,FALSE,TRUE,FALSE,TRUE
out,FALSE,FALSE,FALSE,FALSE,INV: what's next ?,FALSE,TRUE,FALSE,TRUE
out,FALSE,FALSE,FALSE,FALSE,CHI: the fellow with the bag .,FALSE,TRUE,FALSE,TRUE
out,FALSE,FALSE,FALSE,FALSE,INV: there wasn't one .,FALSE,TRUE,FALSE,TRUE
out,FALSE,FALSE,FALSE,FALSE,CHI: the one with the brown suit .,FALSE,TRUE,FALSE,TRUE
out,FALSE,FALSE,FALSE,FALSE,CHI: think I [/] I'll change this for a fellow kneeling down .,FALSE,TRUE,FALSE,TRUE
out,FALSE,FALSE,FALSE,FALSE,INV: you can have them both .,FALSE,TRUE,FALSE,TRUE
out,FALSE,FALSE,FALSE,FALSE,INV: that's the lady holding a baby .,FALSE,TRUE,FALSE,TRUE
out,FALSE,FALSE,FALSE,FALSE,INV: this is the one who's sweeping the floor .,FALSE,TRUE,FALSE,TRUE
out,FALSE,FALSE,FALSE,FALSE,INV: that's the lady with the green coat on .,FALSE,TRUE,FALSE,TRUE
out,FALSE,FALSE,FALSE,FALSE,CHI: the lady with [//] who [=? who's] sweeping the floor .,FALSE,TRUE,FALSE,TRUE
out,FALSE,FALSE,FALSE,FALSE,CHI: the lady with the babies .,FALSE,TRUE,FALSE,TRUE
out,FALSE,FALSE,FALSE,FALSE,CHI: <she can> [/] she can be looking for something for her baby .,FALSE,TRUE,FALSE,TRUE
out,FALSE,FALSE,FALSE,FALSE,INV: think she dropped something ?,FALSE,TRUE,FALSE,TRUE
out,FALSE,FALSE,FALSE,FALSE,CHI: yeah .,FALSE,TRUE,FALSE,TRUE
out,FALSE,FALSE,FALSE,FALSE,INV: okay .,FALSE,TRUE,FALSE,TRUE
out,FALSE,FALSE,FALSE,FALSE,CHI: the lady with the green coat .,FALSE,TRUE,FALSE,TRUE
out,FALSE,FALSE,FALSE,FALSE,INV: oh .,FALSE,TRUE,FALSE,TRUE
out,FALSE,FALSE,FALSE,FALSE,CHI: talking to him .,FALSE,TRUE,FALSE,TRUE
out,FALSE,FALSE,FALSE,FALSE,INV: here's a cat who's lying down .,FALSE,TRUE,FALSE,TRUE
out,FALSE,FALSE,FALSE,FALSE,INV: that's the brown cat standing up .,FALSE,TRUE,FALSE,TRUE
out,FALSE,FALSE,FALSE,FALSE,CHI: the cat what's lying down .,FALSE,TRUE,FALSE,TRUE
out,FALSE,FALSE,FALSE,FALSE,CHI: the cat what [=? what's] standing up .,FALSE,TRUE,FALSE,TRUE
out,FALSE,FALSE,FALSE,FALSE,INV: have you got a cat ?,FALSE,TRUE,FALSE,TRUE
out,FALSE,FALSE,FALSE,FALSE,CHI: no .,FALSE,TRUE,FALSE,TRUE
in,TRUE,FALSE,FALSE,TRUE,INV: I don't like cats .,TRUE,TRUE,TRUE,TRUE
in,FALSE,TRUE,FALSE,FALSE,CHI: my aunty doesn't like +...,TRUE,TRUE,TRUE,TRUE
in,FALSE,FALSE,FALSE,TRUE,INV: my aunty useta have a cat .,TRUE,TRUE,TRUE,TRUE
in,FALSE,TRUE,FALSE,FALSE,CHI: but [//] <and she> [/] and was &~aller +...,TRUE,TRUE,TRUE,TRUE
in,FALSE,FALSE,FALSE,FALSE,CHI: she didn't like them .,TRUE,TRUE,TRUE,TRUE
in,FALSE,FALSE,TRUE,TRUE,CHI: and when [//] she had a disease so when [/] when the cat died it just went away .,TRUE,TRUE,TRUE,TRUE
out,FALSE,FALSE,FALSE,FALSE,INV: here's the one who's lying down having a sleep .,FALSE,FALSE,FALSE,FALSE
out,FALSE,FALSE,FALSE,FALSE,INV: and this is the one who's jumping up .,FALSE,FALSE,FALSE,FALSE
out,FALSE,FALSE,FALSE,FALSE,CHI: dogs what jumping up .,FALSE,FALSE,FALSE,FALSE
out,FALSE,FALSE,FALSE,FALSE,INV: she's not scared of him .,FALSE,FALSE,FALSE,FALSE
out,FALSE,FALSE,FALSE,FALSE,CHI: dog what's go [//] lying down .,FALSE,FALSE,FALSE,FALSE
out,FALSE,FALSE,FALSE,FALSE,INV: have you ever been bitten by a dog ?,FALSE,FALSE,FALSE,FALSE
in,TRUE,TRUE,FALSE,FALSE,"CHI: no , my dad has at school .",TRUE,TRUE,TRUE,TRUE
out,FALSE,FALSE,FALSE,FALSE,INV: a big one ?,TRUE,TRUE,TRUE,TRUE
out,FALSE,FALSE,FALSE,FALSE,CHI: yeah .,TRUE,TRUE,TRUE,TRUE
out,FALSE,FALSE,FALSE,FALSE,INV: did it hurt ?,TRUE,TRUE,TRUE,TRUE
out,FALSE,FALSE,FALSE,FALSE,CHI: I don't know .,TRUE,TRUE,TRUE,TRUE
out,FALSE,FALSE,FALSE,FALSE,INV: did he have a mark on him ?,TRUE,TRUE,TRUE,TRUE
in,FALSE,FALSE,TRUE,TRUE,"CHI: no , he had a real [?] hole through his shirt .",TRUE,TRUE,TRUE,TRUE
out,FALSE,FALSE,FALSE,FALSE,INV: what kind of dog was it ?,FALSE,FALSE,FALSE,FALSE
out,FALSE,FALSE,FALSE,FALSE,CHI: don't know .,FALSE,FALSE,FALSE,FALSE
out,FALSE,FALSE,FALSE,FALSE,INV: that's the girl who's running .,FALSE,FALSE,FALSE,FALSE
out,FALSE,FALSE,FALSE,FALSE,INV: this one's playing with a baby in a pram .,FALSE,FALSE,FALSE,FALSE
out,FALSE,FALSE,FALSE,FALSE,INV: that one's got a Cindy doll .,FALSE,FALSE,FALSE,FALSE
out,FALSE,FALSE,FALSE,FALSE,CHI: the one with the doll .,FALSE,FALSE,FALSE,FALSE
out,FALSE,FALSE,FALSE,FALSE,INV: how old (i)s your sister ?,FALSE,FALSE,FALSE,FALSE
out,FALSE,FALSE,FALSE,FALSE,CHI: nine .,FALSE,FALSE,FALSE,FALSE
out,FALSE,FALSE,FALSE,FALSE,INV: what school is she in ?,FALSE,FALSE,FALSE,FALSE
out,FALSE,FALSE,FALSE,FALSE,CHI: same school ?,FALSE,FALSE,FALSE,FALSE
out,FALSE,FALSE,FALSE,FALSE,INV: do they go up to nine here ?,FALSE,FALSE,FALSE,FALSE
out,FALSE,FALSE,FALSE,FALSE,"CHI: no , fourth (.) in the juniors' .",FALSE,FALSE,FALSE,FALSE
out,FALSE,FALSE,FALSE,FALSE,INV: I see .,FALSE,FALSE,FALSE,FALSE
out,FALSE,FALSE,FALSE,FALSE,CHI: but she's in the [?] third year .,FALSE,FALSE,FALSE,FALSE
out,FALSE,FALSE,FALSE,FALSE,INV: oh .,FALSE,FALSE,FALSE,FALSE
out,FALSE,FALSE,FALSE,FALSE,CHI: the one with the pram .,FALSE,FALSE,FALSE,FALSE
out,FALSE,FALSE,FALSE,FALSE,INV: do you come to school together ?,FALSE,FALSE,FALSE,FALSE
out,FALSE,FALSE,FALSE,FALSE,CHI: yeah .,FALSE,FALSE,FALSE,FALSE
out,FALSE,FALSE,FALSE,FALSE,INV: right .,FALSE,FALSE,FALSE,FALSE
out,FALSE,FALSE,FALSE,FALSE,CHI: and the one who's running away .,FALSE,FALSE,FALSE,FALSE
out,FALSE,FALSE,FALSE,FALSE,INV: maybe she's late for school .,FALSE,FALSE,FALSE,FALSE
out,FALSE,FALSE,FALSE,FALSE,CHI: yeah .,FALSE,FALSE,FALSE,FALSE
out,FALSE,FALSE,FALSE,FALSE,INV: here's a ball with red spots .,FALSE,FALSE,FALSE,FALSE
out,FALSE,FALSE,FALSE,FALSE,INV: that's the ball that the boy is kicking .,FALSE,FALSE,FALSE,FALSE
out,FALSE,FALSE,FALSE,FALSE,INV: those are the two balls that the girl is holding .,FALSE,FALSE,FALSE,FALSE
out,FALSE,FALSE,FALSE,FALSE,CHI: the boy what kicking the ball .,FALSE,FALSE,FALSE,FALSE
out,FALSE,FALSE,FALSE,FALSE,CHI: the ordinary ball .,FALSE,FALSE,FALSE,FALSE
out,FALSE,FALSE,FALSE,FALSE,CHI: and the girl with the two balls .,FALSE,FALSE,FALSE,FALSE
out,FALSE,FALSE,FALSE,FALSE,INV: can you juggle ?,FALSE,FALSE,FALSE,FALSE
out,FALSE,FALSE,FALSE,FALSE,CHI: yeah .,FALSE,FALSE,FALSE,FALSE
out,FALSE,FALSE,FALSE,FALSE,INV: have you tried it ?,FALSE,FALSE,FALSE,FALSE
in,TRUE,TRUE,FALSE,FALSE,"CHI: yeah , I can only juggle +...",TRUE,TRUE,TRUE,TRUE
in,FALSE,FALSE,FALSE,TRUE,INV: my cousin can juggle with four balls .,TRUE,TRUE,TRUE,TRUE
in,FALSE,TRUE,TRUE,FALSE,CHI: and I can juggle with three .,TRUE,TRUE,TRUE,TRUE
out,FALSE,FALSE,FALSE,FALSE,INV: don't you drop them ?,FALSE,TRUE,FALSE,TRUE
out,FALSE,FALSE,FALSE,FALSE,CHI: no .,FALSE,TRUE,FALSE,TRUE
out,FALSE,FALSE,FALSE,FALSE,INV: there's the blue car .,FALSE,TRUE,FALSE,TRUE
out,FALSE,FALSE,FALSE,FALSE,INV: that's the car with the green wheels .,FALSE,TRUE,FALSE,TRUE
out,FALSE,FALSE,FALSE,FALSE,INV: that's the racing car that the boy is pulling .,FALSE,TRUE,FALSE,TRUE
out,FALSE,FALSE,FALSE,FALSE,CHI: the car what the boy's pulling .,FALSE,TRUE,FALSE,TRUE
out,FALSE,FALSE,FALSE,FALSE,INV: right .,FALSE,TRUE,FALSE,TRUE
out,FALSE,FALSE,FALSE,FALSE,CHI: the go-cart .,FALSE,TRUE,FALSE,TRUE
out,FALSE,FALSE,FALSE,FALSE,CHI: and the other car .,FALSE,TRUE,FALSE,TRUE
out,FALSE,FALSE,FALSE,FALSE,@Situation: sent comp,FALSE,TRUE,FALSE,TRUE
in,TRUE,FALSE,FALSE,TRUE,INV: these children have lots_of pets .,TRUE,TRUE,TRUE,TRUE
in,FALSE,TRUE,FALSE,FALSE,"INV: the turtle is hers , the budgie@c is his and the dog is +...",TRUE,TRUE,TRUE,TRUE
in,FALSE,FALSE,TRUE,FALSE,CHI: ++ both of those .,TRUE,TRUE,TRUE,TRUE
in,TRUE,FALSE,FALSE,TRUE,INV: every day when John gets sleepy +...,TRUE,TRUE,TRUE,TRUE
out,FALSE,FALSE,FALSE,FALSE,CHI: 0 .,TRUE,FALSE,FALSE,TRUE
out,FALSE,FALSE,FALSE,FALSE,INV: what does he do ?,TRUE,FALSE,FALSE,TRUE
in,FALSE,TRUE,TRUE,FALSE,CHI: yawns .,TRUE,TRUE,TRUE,TRUE
in,TRUE,FALSE,FALSE,TRUE,INV: every day when Mary gets hungry +...,TRUE,TRUE,TRUE,TRUE
in,FALSE,TRUE,FALSE,FALSE,CHI: ++ she eats her breakfast .,TRUE,TRUE,TRUE,TRUE
out,FALSE,FALSE,FALSE,FALSE,INV: what do you think she's eating ?,TRUE,TRUE,TRUE,TRUE
out,FALSE,FALSE,FALSE,FALSE,CHI: I don't know .,TRUE,TRUE,TRUE,TRUE
out,FALSE,FALSE,FALSE,FALSE,INV: that looks like cakes „ doesn't it ?,TRUE,TRUE,TRUE,TRUE
out,FALSE,FALSE,FALSE,FALSE,CHI: uhhuh .,TRUE,TRUE,TRUE,TRUE
out,FALSE,FALSE,FALSE,FALSE,INV: do you think that's cor(n)flakes or Weetabix ?,TRUE,TRUE,TRUE,TRUE
in,FALSE,FALSE,FALSE,FALSE,CHI: cornflakes .,TRUE,TRUE,TRUE,TRUE
out,FALSE,FALSE,FALSE,FALSE,INV: is that what you have in the mornings ?,TRUE,TRUE,TRUE,TRUE
in,FALSE,FALSE,FALSE,TRUE,"CHI: no , I don't have nothing .",TRUE,TRUE,TRUE,TRUE
out,FALSE,FALSE,FALSE,FALSE,INV: why not ?,TRUE,FALSE,FALSE,TRUE
in,FALSE,TRUE,TRUE,FALSE,CHI: I'm not starve .,TRUE,TRUE,TRUE,TRUE
in,TRUE,FALSE,FALSE,TRUE,INV: Jill found a bird's nest outside in a tree .,TRUE,TRUE,TRUE,TRUE
in,FALSE,TRUE,FALSE,FALSE,INV: she showed it +...,TRUE,TRUE,TRUE,TRUE
in,FALSE,FALSE,TRUE,TRUE,CHI: ++ to her friends .,TRUE,TRUE,TRUE,TRUE
in,TRUE,TRUE,FALSE,FALSE,INV: yesterday was Peter's birthday .,TRUE,TRUE,TRUE,TRUE
in,FALSE,FALSE,FALSE,TRUE,INV: dad gave +...,TRUE,TRUE,TRUE,TRUE
in,FALSE,TRUE,TRUE,FALSE,CHI: ++ him a balloon .,TRUE,TRUE,TRUE,TRUE
in,TRUE,FALSE,FALSE,TRUE,"INV: yesterday when William came home , he saw that his brother +...",TRUE,TRUE,TRUE,TRUE
in,FALSE,TRUE,TRUE,FALSE,CHI: ++ was watching the tellie .,TRUE,TRUE,TRUE,TRUE
in,TRUE,FALSE,FALSE,TRUE,INV: Sally and Jane climbed up into this tree .,TRUE,TRUE,TRUE,TRUE
in,FALSE,TRUE,FALSE,FALSE,INV: if they fall out_of the tree now +...,TRUE,TRUE,TRUE,TRUE
in,FALSE,FALSE,TRUE,TRUE,CHI: ++ they will hurt themselves .,TRUE,TRUE,TRUE,TRUE
in,TRUE,TRUE,FALSE,FALSE,INV: James wanted to get some biscuits from the table .,TRUE,TRUE,TRUE,TRUE
in,FALSE,FALSE,FALSE,FALSE,INV: so he stood on tiptoes and he stretched and stretched +...,TRUE,TRUE,TRUE,TRUE
in,FALSE,FALSE,TRUE,FALSE,CHI: ++ but he couldn't reach them .,TRUE,TRUE,TRUE,TRUE
in,TRUE,FALSE,FALSE,TRUE,INV: it was very late and Peter was tired .,TRUE,TRUE,TRUE,TRUE
in,FALSE,TRUE,FALSE,FALSE,INV: his mummie said you@q +...,TRUE,TRUE,TRUE,TRUE
in,FALSE,FALSE,TRUE,TRUE,CHI: ++ go to bed .,TRUE,TRUE,TRUE,TRUE
in,TRUE,TRUE,FALSE,FALSE,INV: Eddie didn't know how to tie his shoes so he if [?] his mother +...,TRUE,TRUE,TRUE,TRUE
in,FALSE,FALSE,TRUE,FALSE,CHI: ++ will do them .,TRUE,TRUE,TRUE,TRUE
in,TRUE,FALSE,FALSE,TRUE,INV: some children walk to school and some ride the bus .,TRUE,TRUE,TRUE,TRUE
in,FALSE,TRUE,FALSE,FALSE,INV: these are the children +...,TRUE,TRUE,TRUE,TRUE
in,FALSE,FALSE,TRUE,TRUE,CHI: ++ who walk .,TRUE,TRUE,TRUE,TRUE
in,TRUE,TRUE,FALSE,FALSE,INV: this is a road in Liverpool .,TRUE,TRUE,TRUE,TRUE
in,FALSE,FALSE,FALSE,FALSE,INV: Nick lives in one of these houses .,TRUE,TRUE,TRUE,TRUE
in,FALSE,FALSE,FALSE,FALSE,INV: this is the house +...,TRUE,TRUE,TRUE,TRUE
in,FALSE,FALSE,TRUE,TRUE,CHI: ++ it is colored in red .,TRUE,TRUE,TRUE,TRUE
in,TRUE,TRUE,FALSE,FALSE,INV: mummie has made a cake .,TRUE,TRUE,TRUE,TRUE
in,FALSE,FALSE,FALSE,TRUE,INV: Christine has bought some cake and she's eating it .,TRUE,TRUE,TRUE,TRUE
in,FALSE,TRUE,FALSE,FALSE,INV: Mary wants the cake +...,TRUE,TRUE,TRUE,TRUE
in,FALSE,FALSE,TRUE,FALSE,CHI: ++ she asked her if she can have a cake .,TRUE,TRUE,TRUE,TRUE
in,TRUE,FALSE,FALSE,TRUE,INV: Ron and Paul had a race .,TRUE,TRUE,TRUE,TRUE
in,FALSE,TRUE,FALSE,FALSE,INV: they both ran very fast but Paul won because he could run +...,TRUE,TRUE,TRUE,TRUE
in,FALSE,FALSE,TRUE,FALSE,CHI: ++ faster .,TRUE,TRUE,TRUE,TRUE
out,FALSE,FALSE,FALSE,FALSE,INV: do you get top marks in your class ?,FALSE,TRUE,FALSE,TRUE
out,FALSE,FALSE,FALSE,FALSE,"CHI: no , some are [?] wrong .",FALSE,TRUE,FALSE,TRUE
out,FALSE,FALSE,FALSE,FALSE,CHI: <when I> [/] when I first started I got some wrong .,FALSE,TRUE,FALSE,TRUE
in,TRUE,FALSE,FALSE,TRUE,INV: here's Debbie and her sister .,TRUE,TRUE,TRUE,TRUE
in,FALSE,TRUE,FALSE,FALSE,INV: Debbie is a tall girl but she's not as tall +...,TRUE,TRUE,TRUE,TRUE
in,FALSE,FALSE,TRUE,TRUE,CHI: ++ as her sister .,TRUE,TRUE,TRUE,TRUE
in,TRUE,TRUE,FALSE,FALSE,"INV: Cathy's balloon is big , Jack's is even bigger , but Tony's is the +...",TRUE,TRUE,TRUE,TRUE
