in/out/ambiguous,start_human,start_llm,end_human,end_llm,Transcript,story_seg_human,story_seg_llm,intersection,union
out,FALSE,FALSE,FALSE,FALSE,JOA: hi .,FALSE,FALSE,FALSE,FALSE
out,FALSE,FALSE,FALSE,FALSE,CHI: hi .,FALSE,FALSE,FALSE,FALSE
out,FALSE,FALSE,FALSE,FALSE,JOA: how are you ?,FALSE,FALSE,FALSE,FALSE
out,FALSE,FALSE,FALSE,FALSE,CHI: I'm fine .,FALSE,FALSE,FALSE,FALSE
out,FALSE,FALSE,FALSE,FALSE,JOA: and who are you ?,FALSE,FALSE,FALSE,FALSE
out,FALSE,FALSE,FALSE,FALSE,CHI: I'm Willie .,FALSE,FALSE,FALSE,FALSE
out,FALSE,FALSE,FALSE,FALSE,JOA: hi Willie .,FALSE,FALSE,FALSE,FALSE
out,FALSE,FALSE,FALSE,FALSE,CHI: hi .,FALSE,FALSE,FALSE,FALSE
out,FALSE,FALSE,FALSE,FALSE,JOA: are you Robbie's friend ?,FALSE,FALSE,FALSE,FALSE
out,FALSE,FALSE,FALSE,FALSE,CHI: yes .,FALSE,FALSE,FALSE,FALSE
out,FALSE,FALSE,FALSE,FALSE,JOA: did you stay overnight with Robbie ?,FALSE,FALSE,FALSE,FALSE
out,FALSE,FALSE,FALSE,FALSE,CHI: yes .,FALSE,FALSE,FALSE,FALSE
out,FALSE,FALSE,FALSE,FALSE,JOA: did you have a good time ?,FALSE,FALSE,FALSE,FALSE
in,TRUE,TRUE,FALSE,FALSE,CHI: we had a good time .,TRUE,TRUE,TRUE,TRUE
in,FALSE,FALSE,FALSE,FALSE,CHI: we stayed up all night .,TRUE,TRUE,TRUE,TRUE
in,FALSE,FALSE,FALSE,FALSE,CHI: we couldn't sleep .,TRUE,TRUE,TRUE,TRUE
out,FALSE,FALSE,FALSE,FALSE,JOA: were you talking ?,TRUE,TRUE,TRUE,TRUE
out,FALSE,FALSE,FALSE,FALSE,CHI: uhhuh .,TRUE,TRUE,TRUE,TRUE
out,FALSE,FALSE,FALSE,FALSE,JOA: where did you sleep ?,TRUE,TRUE,TRUE,TRUE
in,FALSE,FALSE,TRUE,TRUE,CHI: Robbie's bed .,TRUE,TRUE,TRUE,TRUE
out,FALSE,FALSE,FALSE,FALSE,JOA: did you and Robbie sleep together ?,FALSE,FALSE,FALSE,FALSE
out,FALSE,FALSE,FALSE,FALSE,CHI: yes .,FALSE,FALSE,FALSE,FALSE
out,FALSE,FALSE,FALSE,FALSE,JOA: do you know who I am ?,FALSE,FALSE,FALSE,FALSE
out,FALSE,FALSE,FALSE,FALSE,CHI: no .,FALSE,FALSE,FALSE,FALSE
out,FALSE,FALSE,FALSE,FALSE,JOA: I'm Robbie's aunt .,FALSE,FALSE,FALSE,FALSE
out,FALSE,FALSE,FALSE,FALSE,JOA: Aunt Joan .,FALSE,FALSE,FALSE,FALSE
out,FALSE,FALSE,FALSE,FALSE,JOA: Willie will you show me how to play Candyland ?,FALSE,FALSE,FALSE,FALSE
out,FALSE,FALSE,FALSE,FALSE,CHI: yes .,FALSE,FALSE,FALSE,FALSE
out,FALSE,FALSE,FALSE,FALSE,JOA: where is the Candyland game ?,FALSE,FALSE,FALSE,FALSE
in,TRUE,TRUE,FALSE,FALSE,CHI: it's in the other room .,TRUE,TRUE,TRUE,TRUE
in,FALSE,FALSE,FALSE,FALSE,CHI: I'll go get it .,TRUE,TRUE,TRUE,TRUE
in,FALSE,FALSE,TRUE,FALSE,CHI: here it is !,TRUE,TRUE,TRUE,TRUE
out,FALSE,FALSE,FALSE,FALSE,JOA: what do I do Willie ?,FALSE,TRUE,FALSE,TRUE
out,FALSE,FALSE,FALSE,FALSE,CHI: you move here .,FALSE,TRUE,FALSE,TRUE
out,FALSE,FALSE,FALSE,FALSE,JOA: what color should I be Willie ?,FALSE,TRUE,FALSE,TRUE
out,FALSE,FALSE,FALSE,FALSE,CHI: you be blue .,FALSE,TRUE,FALSE,TRUE
out,FALSE,FALSE,FALSE,FALSE,JOA: what color are you ?,FALSE,TRUE,FALSE,TRUE
out,FALSE,FALSE,FALSE,FALSE,CHI: I'm red .,FALSE,TRUE,FALSE,TRUE
out,FALSE,FALSE,FALSE,FALSE,JOA: what do we do with the cards ?,FALSE,TRUE,FALSE,TRUE
out,FALSE,FALSE,FALSE,FALSE,CHI: leave them here .,FALSE,TRUE,FALSE,TRUE
out,FALSE,FALSE,FALSE,FALSE,JOA: who picks the first card Willie ?,FALSE,TRUE,FALSE,TRUE
out,FALSE,FALSE,FALSE,FALSE,CHI: I do !,FALSE,TRUE,FALSE,TRUE
out,FALSE,FALSE,FALSE,FALSE,JOA: what do you have on your card ?,FALSE,TRUE,FALSE,TRUE
out,FALSE,FALSE,FALSE,FALSE,CHI: candy .,FALSE,TRUE,FALSE,TRUE
out,FALSE,FALSE,FALSE,FALSE,JOA: where do you go ?,FALSE,TRUE,FALSE,TRUE
out,FALSE,FALSE,FALSE,FALSE,CHI: there .,FALSE,TRUE,FALSE,TRUE
out,FALSE,FALSE,FALSE,FALSE,JOA: what do I do ?,FALSE,TRUE,FALSE,TRUE
out,FALSE,FALSE,FALSE,FALSE,CHI: you pick a card .,FALSE,TRUE,FALSE,TRUE
out,FALSE,FALSE,FALSE,FALSE,JOA: what kind of candy do I have ?,FALSE,TRUE,FALSE,TRUE
out,FALSE,FALSE,FALSE,FALSE,JOA: are they gumdrops ?,FALSE,TRUE,FALSE,TRUE
out,FALSE,FALSE,FALSE,FALSE,CHI: no !,FALSE,TRUE,FALSE,TRUE
out,FALSE,FALSE,FALSE,FALSE,CHI: not gumdrops .,FALSE,TRUE,FALSE,TRUE
out,FALSE,FALSE,FALSE,FALSE,CHI: it's a sucker .,FALSE,TRUE,FALSE,TRUE
out,FALSE,FALSE,FALSE,FALSE,JOA: where do I go ?,FALSE,TRUE,FALSE,TRUE
out,FALSE,FALSE,FALSE,FALSE,CHI: to the sucker square .,FALSE,TRUE,FALSE,TRUE
out,FALSE,FALSE,FALSE,FALSE,JOA: and what do I do with my card ?,FALSE,TRUE,FALSE,TRUE
out,FALSE,FALSE,FALSE,FALSE,CHI: keep it .,FALSE,TRUE,FALSE,TRUE
out,FALSE,FALSE,FALSE,FALSE,CHI: oh !,FALSE,TRUE,FALSE,TRUE
out,FALSE,FALSE,FALSE,FALSE,CHI: two gingerbreads .,FALSE,TRUE,FALSE,TRUE
out,FALSE,FALSE,FALSE,FALSE,CHI: oh !,FALSE,TRUE,FALSE,TRUE
in,TRUE,FALSE,FALSE,FALSE,CHI: I got hearts !,TRUE,TRUE,TRUE,TRUE
in,FALSE,FALSE,FALSE,TRUE,CHI: I hate hearts !,TRUE,TRUE,TRUE,TRUE
out,FALSE,FALSE,FALSE,FALSE,JOA: why do you hate hearts ?,TRUE,FALSE,FALSE,TRUE
in,FALSE,TRUE,FALSE,FALSE,CHI: (be)cause I hafta go backwards .,TRUE,TRUE,TRUE,TRUE
in,FALSE,FALSE,TRUE,FALSE,CHI: I hate going backwards .,TRUE,TRUE,TRUE,TRUE
out,FALSE,FALSE,FALSE,FALSE,JOA: my turn .,FALSE,TRUE,FALSE,TRUE
out,FALSE,FALSE,FALSE,FALSE,JOA: what's that ?,FALSE,TRUE,FALSE,TRUE
out,FALSE,FALSE,FALSE,FALSE,CHI: candy .,FALSE,TRUE,FALSE,TRUE
out,FALSE,FALSE,FALSE,FALSE,JOA: I go over there ?,FALSE,TRUE,FALSE,TRUE
out,FALSE,FALSE,FALSE,FALSE,CHI: uhhuh .,FALSE,TRUE,FALSE,TRUE
out,FALSE,FALSE,FALSE,FALSE,JOA: what did you get ?,FALSE,TRUE,FALSE,TRUE
out,FALSE,FALSE,FALSE,FALSE,CHI: a green one .,FALSE,TRUE,FALSE,TRUE
out,FALSE,FALSE,FALSE,FALSE,JOA: what's that ?,FALSE,TRUE,FALSE,TRUE
out,FALSE,FALSE,FALSE,FALSE,CHI: I don't know .,FALSE,TRUE,FALSE,TRUE
out,FALSE,FALSE,FALSE,FALSE,JOA: I don't know either .,FALSE,TRUE,FALSE,TRUE
out,FALSE,FALSE,FALSE,FALSE,CHI: there it is !,FALSE,TRUE,FALSE,TRUE
in,TRUE,FALSE,FALSE,TRUE,CHI: now you go two greens .,TRUE,TRUE,TRUE,TRUE
in,FALSE,TRUE,FALSE,FALSE,CHI: I'm gaining on you .,TRUE,TRUE,TRUE,TRUE
out,FALSE,FALSE,FALSE,FALSE,JOA: I know you are .,TRUE,TRUE,TRUE,TRUE
in,FALSE,FALSE,FALSE,TRUE,JOA: I think you're going to win this game .,TRUE,TRUE,TRUE,TRUE
out,FALSE,FALSE,FALSE,FALSE,CHI: &-uh huh .,TRUE,FALSE,FALSE,TRUE
in,FALSE,TRUE,FALSE,FALSE,CHI: I'm winning .,TRUE,TRUE,TRUE,TRUE
in,FALSE,FALSE,TRUE,TRUE,CHI: now you hafta go backwards until you get here again .,TRUE,TRUE,TRUE,TRUE
out,FALSE,FALSE,FALSE,FALSE,JOA: do I go to the orange ?,FALSE,FALSE,FALSE,FALSE
out,FALSE,FALSE,FALSE,FALSE,CHI: uhhuh .,FALSE,FALSE,FALSE,FALSE
out,FALSE,FALSE,FALSE,FALSE,CHI: I wish I could pick an orange .,FALSE,FALSE,FALSE,FALSE
out,FALSE,FALSE,FALSE,FALSE,CHI: green again !,FALSE,FALSE,FALSE,FALSE
out,FALSE,FALSE,FALSE,FALSE,CHI: green green green !,FALSE,FALSE,FALSE,FALSE
out,FALSE,FALSE,FALSE,FALSE,JOA: my turn .,FALSE,FALSE,FALSE,FALSE
out,FALSE,FALSE,FALSE,FALSE,JOA: I got the same one Willie .,FALSE,FALSE,FALSE,FALSE
out,FALSE,FALSE,FALSE,FALSE,CHI: oh !,FALSE,FALSE,FALSE,FALSE
out,FALSE,FALSE,FALSE,FALSE,CHI: two greens !,FALSE,FALSE,FALSE,FALSE
out,FALSE,FALSE,FALSE,FALSE,CHI: two greens too !,FALSE,FALSE,FALSE,FALSE
in,TRUE,TRUE,FALSE,FALSE,CHI: I'm leading .,TRUE,TRUE,TRUE,TRUE
in,FALSE,FALSE,FALSE,FALSE,CHI: now you hafta go backwards .,TRUE,TRUE,TRUE,TRUE
in,FALSE,FALSE,FALSE,FALSE,CHI: you stay here .,TRUE,TRUE,TRUE,TRUE
in,FALSE,FALSE,FALSE,FALSE,CHI: you hafta go all the way back again .,TRUE,TRUE,TRUE,TRUE
in,FALSE,FALSE,FALSE,TRUE,CHI: another blue .,TRUE,TRUE,TRUE,TRUE
in,FALSE,TRUE,FALSE,FALSE,CHI: you're losing .,TRUE,TRUE,TRUE,TRUE
out,FALSE,FALSE,FALSE,FALSE,CHI: oh !,TRUE,TRUE,TRUE,TRUE
in,FALSE,FALSE,FALSE,FALSE,CHI: you're with me .,TRUE,TRUE,TRUE,TRUE
in,FALSE,FALSE,FALSE,TRUE,CHI: you can't move .,TRUE,TRUE,TRUE,TRUE
in,FALSE,TRUE,TRUE,FALSE,CHI: you hafta wait (un)til you get another blue .,TRUE,TRUE,TRUE,TRUE
out,FALSE,FALSE,FALSE,FALSE,JOA: can't I do anything until I get another blue ?,FALSE,TRUE,FALSE,TRUE
out,FALSE,FALSE,FALSE,FALSE,CHI: right .,FALSE,TRUE,FALSE,TRUE
out,FALSE,FALSE,FALSE,FALSE,JOA: who is going to win this game ?,FALSE,TRUE,FALSE,TRUE
out,FALSE,FALSE,FALSE,FALSE,CHI: I am .,FALSE,TRUE,FALSE,TRUE
out,FALSE,FALSE,FALSE,FALSE,JOA: what did you get ?,FALSE,TRUE,FALSE,TRUE
out,FALSE,FALSE,FALSE,FALSE,CHI: a blue .,FALSE,TRUE,FALSE,TRUE
out,FALSE,FALSE,FALSE,FALSE,CHI: another blue .,FALSE,TRUE,FALSE,TRUE
out,FALSE,FALSE,FALSE,FALSE,CHI: now I can't move .,FALSE,TRUE,FALSE,TRUE
out,FALSE,FALSE,FALSE,FALSE,CHI: I hafta wait .,FALSE,TRUE,FALSE,TRUE
out,FALSE,FALSE,FALSE,FALSE,JOA: look at my card Willie .,FALSE,TRUE,FALSE,TRUE
out,FALSE,FALSE,FALSE,FALSE,JOA: what do I do ?,FALSE,TRUE,FALSE,TRUE
out,FALSE,FALSE,FALSE,FALSE,CHI: stay there .,FALSE,TRUE,FALSE,TRUE
out,FALSE,FALSE,FALSE,FALSE,JOA: did you get my blue ?,FALSE,TRUE,FALSE,TRUE
out,FALSE,FALSE,FALSE,FALSE,CHI: yes .,FALSE,TRUE,FALSE,TRUE
out,FALSE,FALSE,FALSE,FALSE,CHI: look out !,FALSE,TRUE,FALSE,TRUE
in,TRUE,FALSE,FALSE,TRUE,CHI: I don't wanna hafta go down there .,TRUE,TRUE,TRUE,TRUE
in,FALSE,TRUE,FALSE,FALSE,CHI: you're gaining on me .,TRUE,TRUE,TRUE,TRUE
in,FALSE,FALSE,FALSE,FALSE,CHI: I was going backwards for a while .,TRUE,TRUE,TRUE,TRUE
in,FALSE,FALSE,FALSE,TRUE,CHI: I forgot to go that way .,TRUE,TRUE,TRUE,TRUE
in,FALSE,TRUE,FALSE,FALSE,CHI: I went that way .,TRUE,TRUE,TRUE,TRUE
in,FALSE,FALSE,FALSE,FALSE,CHI: I was going there .,TRUE,TRUE,TRUE,TRUE
out,FALSE,FALSE,FALSE,FALSE,JOA: you were ?,TRUE,TRUE,TRUE,TRUE
out,FALSE,FALSE,FALSE,FALSE,JOA: why ?,TRUE,TRUE,TRUE,TRUE
out,FALSE,FALSE,FALSE,FALSE,CHI: I don't know .,TRUE,TRUE,TRUE,TRUE
in,FALSE,FALSE,FALSE,TRUE,CHI: when all the cards are gone you hafta add cards .,TRUE,TRUE,TRUE,TRUE
in,FALSE,TRUE,FALSE,FALSE,CHI: change em .,TRUE,TRUE,TRUE,TRUE
in,FALSE,FALSE,FALSE,FALSE,CHI: ten .,TRUE,TRUE,TRUE,TRUE
in,FALSE,FALSE,FALSE,TRUE,CHI: gotta change em .,TRUE,TRUE,TRUE,TRUE
out,FALSE,FALSE,FALSE,FALSE,JOA: just ten ?,TRUE,FALSE,FALSE,TRUE
out,FALSE,FALSE,FALSE,FALSE,CHI: yes .,TRUE,FALSE,FALSE,TRUE
in,FALSE,TRUE,FALSE,FALSE,CHI: ten cards .,TRUE,TRUE,TRUE,TRUE
in,FALSE,FALSE,FALSE,TRUE,CHI: I think I'm gonna win .,TRUE,TRUE,TRUE,TRUE
in,FALSE,TRUE,FALSE,FALSE,CHI: put some on the pile .,TRUE,TRUE,TRUE,TRUE
in,FALSE,FALSE,FALSE,TRUE,CHI: I still think I'm gonna win .,TRUE,TRUE,TRUE,TRUE
in,FALSE,TRUE,FALSE,FALSE,CHI: all I ever get is green .,TRUE,TRUE,TRUE,TRUE
in,FALSE,FALSE,FALSE,TRUE,CHI: you're behind me .,TRUE,TRUE,TRUE,TRUE
in,FALSE,TRUE,FALSE,FALSE,CHI: you're ahead of me .,TRUE,TRUE,TRUE,TRUE
in,FALSE,FALSE,FALSE,TRUE,CHI: tie score .,TRUE,TRUE,TRUE,TRUE
in,FALSE,TRUE,FALSE,FALSE,CHI: oh oh we're tied .,TRUE,TRUE,TRUE,TRUE
in,FALSE,FALSE,FALSE,FALSE,CHI: I hafta get a purple .,TRUE,TRUE,TRUE,TRUE
in,FALSE,FALSE,FALSE,FALSE,CHI: oh .,TRUE,TRUE,TRUE,TRUE
in,FALSE,FALSE,FALSE,FALSE,CHI: purple !,TRUE,TRUE,TRUE,TRUE
in,FALSE,FALSE,FALSE,FALSE,CHI: I win the game !,TRUE,TRUE,TRUE,TRUE
in,FALSE,FALSE,FALSE,FALSE,CHI: here it is !,TRUE,TRUE,TRUE,TRUE
in,FALSE,FALSE,TRUE,TRUE,CHI: I'll turn it on .,TRUE,TRUE,TRUE,TRUE
out,FALSE,FALSE,FALSE,FALSE,JOA: oh look at that !,FALSE,FALSE,FALSE,FALSE
out,FALSE,FALSE,FALSE,FALSE,JOA: what are they Willie ?,FALSE,FALSE,FALSE,FALSE
in,TRUE,TRUE,FALSE,FALSE,CHI: they're penguins .,TRUE,TRUE,TRUE,TRUE
out,FALSE,FALSE,FALSE,FALSE,JOA: what are they doing ?,TRUE,TRUE,TRUE,TRUE
in,FALSE,FALSE,FALSE,TRUE,CHI: riding .,TRUE,TRUE,TRUE,TRUE
out,FALSE,FALSE,FALSE,FALSE,JOA: how many penguins are there ?,TRUE,FALSE,FALSE,TRUE
in,FALSE,TRUE,FALSE,FALSE,CHI: three .,TRUE,TRUE,TRUE,TRUE
out,FALSE,FALSE,FALSE,FALSE,JOA: what colors are they ?,TRUE,TRUE,TRUE,TRUE
in,FALSE,FALSE,FALSE,TRUE,CHI: black red and blue .,TRUE,TRUE,TRUE,TRUE
out,FALSE,FALSE,FALSE,FALSE,JOA: what are the penguins doing ?,TRUE,FALSE,FALSE,TRUE
in,FALSE,TRUE,FALSE,FALSE,CHI: climbing the stairs .,TRUE,TRUE,TRUE,TRUE
out,FALSE,FALSE,FALSE,FALSE,JOA: and then what happens ?,TRUE,TRUE,TRUE,TRUE
in,FALSE,FALSE,FALSE,FALSE,CHI: they slide .,TRUE,TRUE,TRUE,TRUE
out,FALSE,FALSE,FALSE,FALSE,JOA: what do you do when one of them gets stuck ?,TRUE,TRUE,TRUE,TRUE
in,FALSE,FALSE,FALSE,TRUE,CHI: push em .,TRUE,TRUE,TRUE,TRUE
out,FALSE,FALSE,FALSE,FALSE,JOA: which penguin do you like best ?,TRUE,FALSE,FALSE,TRUE
in,FALSE,TRUE,FALSE,FALSE,CHI: I like all of them the same .,TRUE,TRUE,TRUE,TRUE
out,FALSE,FALSE,FALSE,FALSE,CHI: the blue penguin's in the lead .,TRUE,TRUE,TRUE,TRUE
in,FALSE,FALSE,FALSE,TRUE,CHI: they all hafta stay in order .,TRUE,TRUE,TRUE,TRUE
out,FALSE,FALSE,FALSE,FALSE,JOA: which one is last ?,TRUE,FALSE,FALSE,TRUE
out,FALSE,FALSE,FALSE,FALSE,CHI: hm: .,TRUE,FALSE,FALSE,TRUE
in,FALSE,TRUE,FALSE,FALSE,CHI: black .,TRUE,TRUE,TRUE,TRUE
in,FALSE,FALSE,TRUE,TRUE,CHI: and here's the little door they hide in .,TRUE,TRUE,TRUE,TRUE
out,FALSE,FALSE,FALSE,FALSE,JOA: what else is in there ?,FALSE,FALSE,FALSE,FALSE
in,TRUE,TRUE,TRUE,FALSE,CHI: the battery .,TRUE,TRUE,TRUE,TRUE
out,FALSE,FALSE,FALSE,FALSE,JOA: what are the flags for ?,FALSE,TRUE,FALSE,TRUE
out,FALSE,FALSE,FALSE,FALSE,CHI: I don't know .,FALSE,TRUE,FALSE,TRUE
in,TRUE,FALSE,TRUE,TRUE,CHI: oh he fell off !,TRUE,TRUE,TRUE,TRUE
out,FALSE,FALSE,FALSE,FALSE,JOA: where do you want me to put it ?,FALSE,FALSE,FALSE,FALSE
out,FALSE,FALSE,FALSE,FALSE,CHI: put it right there .,FALSE,FALSE,FALSE,FALSE
out,FALSE,FALSE,FALSE,FALSE,JOA: oh oh !,FALSE,FALSE,FALSE,FALSE
out,FALSE,FALSE,FALSE,FALSE,JOA: what happened ?,FALSE,FALSE,FALSE,FALSE
in,TRUE,TRUE,FALSE,FALSE,CHI: the track busted .,TRUE,TRUE,TRUE,TRUE
out,FALSE,FALSE,FALSE,FALSE,JOA: do you know how to fix it ?,TRUE,TRUE,TRUE,TRUE
out,FALSE,FALSE,FALSE,FALSE,CHI: yep .,TRUE,TRUE,TRUE,TRUE
out,FALSE,FALSE,FALSE,FALSE,JOA: wait a minute .,TRUE,TRUE,TRUE,TRUE
out,FALSE,FALSE,FALSE,FALSE,JOA: I think it goes there .,TRUE,TRUE,TRUE,TRUE
in,FALSE,FALSE,FALSE,TRUE,CHI: I need two penguins .,TRUE,TRUE,TRUE,TRUE
out,FALSE,FALSE,FALSE,FALSE,JOA: you need two penguins ?,TRUE,FALSE,FALSE,TRUE
in,FALSE,TRUE,FALSE,FALSE,CHI: three .,TRUE,TRUE,TRUE,TRUE
in,FALSE,FALSE,TRUE,TRUE,CHI: this time they're all going to stay in order .,TRUE,TRUE,TRUE,TRUE
out,FALSE,FALSE,FALSE,FALSE,JOA: would you like to have more penguins ?,FALSE,FALSE,FALSE,FALSE
out,FALSE,FALSE,FALSE,FALSE,CHI: uhhuh .,FALSE,FALSE,FALSE,FALSE
out,FALSE,FALSE,FALSE,FALSE,JOA: what colors do you like ?,FALSE,FALSE,FALSE,FALSE
out,FALSE,FALSE,FALSE,FALSE,CHI: I like purple (.) and green (.) orange (.) and red (.) and yellow .,FALSE,FALSE,FALSE,FALSE
out,FALSE,FALSE,FALSE,FALSE,JOA: did you fall Willie ?,FALSE,FALSE,FALSE,FALSE
out,FALSE,FALSE,FALSE,FALSE,CHI: yes .,FALSE,FALSE,FALSE,FALSE
out,FALSE,FALSE,FALSE,FALSE,JOA: at school ?,FALSE,FALSE,FALSE,FALSE
out,FALSE,FALSE,FALSE,FALSE,CHI: no .,FALSE,FALSE,FALSE,FALSE
out,FALSE,FALSE,FALSE,FALSE,JOA: where ?,FALSE,FALSE,FALSE,FALSE
out,FALSE,FALSE,FALSE,FALSE,CHI: home .,FALSE,FALSE,FALSE,FALSE
out,FALSE,FALSE,FALSE,FALSE,JOA: where ?,FALSE,FALSE,FALSE,FALSE
out,FALSE,FALSE,FALSE,FALSE,CHI: on the car .,FALSE,FALSE,FALSE,FALSE
out,FALSE,FALSE,FALSE,FALSE,JOA: thank_you Willie for showing me the games .,FALSE,FALSE,FALSE,FALSE
out,FALSE,FALSE,FALSE,FALSE,CHI: okay we're going out now (.) (.) to play (.) on the bikes .,FALSE,FALSE,FALSE,FALSE
out,FALSE,FALSE,FALSE,FALSE,CHI: see the jacket ?,FALSE,FALSE,FALSE,FALSE
out,FALSE,FALSE,FALSE,FALSE,CHI: it's Robbie's .,FALSE,FALSE,FALSE,FALSE
out,FALSE,FALSE,FALSE,FALSE,CHI: Michael Jackson .,FALSE,FALSE,FALSE,FALSE
out,FALSE,FALSE,FALSE,FALSE,CHI: I can't find my boots .,FALSE,FALSE,FALSE,FALSE
out,FALSE,FALSE,FALSE,FALSE,CHI: where are they ?,FALSE,FALSE,FALSE,FALSE
out,FALSE,FALSE,FALSE,FALSE,CHI: oh they're outside !,FALSE,FALSE,FALSE,FALSE
out,FALSE,FALSE,FALSE,FALSE,CHI: here they are !,FALSE,FALSE,FALSE,FALSE
out,FALSE,FALSE,FALSE,FALSE,JOA: bye Willie .,FALSE,FALSE,FALSE,FALSE
out,FALSE,FALSE,FALSE,FALSE,CHI: bye .,FALSE,FALSE,FALSE,FALSE
